INPUT:text	OUTPUT:complexity	GOLDEN:complexity	HINT:text	HINT:default_language	ASSIGNMENT:task_id	ASSIGNMENT:assignment_id	ASSIGNMENT:worker_id	ASSIGNMENT:started	ASSIGNMENT:submitted
Опираясь на наш опыт, мы хотели бы взаимодействовать со всеми участниками и партнерами Конвенции в поиске практических решений, которые будут способствовать обращению вспять и остановке деградации <mark>земель</mark> на местах.	2				04ee6611-53a6-4ae6-b373-31ca418ae274	00024bafed--642fded281df560524ba4838	bb40a7be26ef3c44a97b5c222e79f84e	2023-04-07T09:13:54.427	2023-04-07T09:15:53.288
"Такое положение сказывается и на приобретении компьютерных технологий: например, американская компания <<Плэнсон>> (""Planson"") не получила от Управления по контролю за иностранными активами (УКИА) лицензию на экспорт <mark>продукции</mark> на Кубу."	1				12304371-6380-4f8e-8931-7372627084ef	00024bafed--642fded281df560524ba4838	bb40a7be26ef3c44a97b5c222e79f84e	2023-04-07T09:13:54.427	2023-04-07T09:15:53.288
На остальные 25% заказов-<mark>нарядов</mark> приходится 90% общих расходов на закупочную деятельность (1,35 млрд. долл. США).	2				3e62d7b0-0ea0-4a84-9bd0-34687a2f934b	00024bafed--642fded281df560524ba4838	bb40a7be26ef3c44a97b5c222e79f84e	2023-04-07T09:13:54.427	2023-04-07T09:15:53.288
143.200 и впредь предпринимать шаги по борьбе с неравенством в <mark>образовании</mark>, в частности по преодолению существующего разрыва в качестве образования в городах и в сельской местности (Бутан);	1				ca95ed67-3728-4e73-829a-cc71334cf975	00024bafed--642fded281df560524ba4838	bb40a7be26ef3c44a97b5c222e79f84e	2023-04-07T09:13:54.427	2023-04-07T09:15:53.288
Присутствие бывших комбатантов, наличие оружия и скопление чрезмерного числа людей на <mark>объектах</mark> привели к значительным проблемам в плане безопасности и роста преступности.	1				be0156d9-f542-4785-b4ee-4566d874756f	00024bafed--642fded281df560524ba4838	bb40a7be26ef3c44a97b5c222e79f84e	2023-04-07T09:13:54.427	2023-04-07T09:15:53.288
Вместе с тем между государствами-членами не было консенсуса ни по этому вопросу, ни по вопросу о том, как такая согласованная <mark>модель</mark> взаимодействия должна быть подготовлена и что она должна содержать.	2				5b824955-f340-4fd2-8e40-6d0ac574d5eb	00024bafed--642fded281df560524ba4838	bb40a7be26ef3c44a97b5c222e79f84e	2023-04-07T09:13:54.427	2023-04-07T09:15:53.288
Продольные бары (например, ограждающий вал), вытянутая <mark>отмель</mark>, пороги, глубокие и мелкие зоны; Расчетные показатели уровня воды; Глубина и ширина фарватера.	2				a3b2a2bc-1740-4f1b-b5ac-9912edd420e6	00024bafed--642fded281df560524ba4838	bb40a7be26ef3c44a97b5c222e79f84e	2023-04-07T09:13:54.427	2023-04-07T09:15:53.288
Конституция защищает и предоставляет основные права и свободы всем лицам, независимо от их национальной принадлежности, расы, <mark>пола</mark>, а также вероисповедания, места рождения или политических предпочтений.	1				4ebe9c59-849b-4323-a237-ba4008473204	00024bafed--642fded281df560524ba4838	bb40a7be26ef3c44a97b5c222e79f84e	2023-04-07T09:13:54.427	2023-04-07T09:15:53.288
Хотя сегодня <mark>тарифы</mark> в среднем намного ниже, чем в 1990-х годах, в определенных секторах по-прежнему сохраняется серьезная обеспокоенность в связи с доступом к рынкам.	2				96e269b9-fdc6-4100-903a-43673286da6d	00024bafed--642fded281df560524ba4838	bb40a7be26ef3c44a97b5c222e79f84e	2023-04-07T09:13:54.427	2023-04-07T09:15:53.288
В <mark>процессе</mark> выполнения как городской, так и загородной части комбинированного испытательного цикла используют единичный фильтр взвешенных частиц без вспомогательного фильтра.	1				56aa8618-1f61-4a0c-ad33-c86bf561669a	00024bafed--642fded281df560524ba4838	bb40a7be26ef3c44a97b5c222e79f84e	2023-04-07T09:13:54.427	2023-04-07T09:15:53.288
42. <mark>Правительство</mark> Российской Федерации продолжает усиливать преследование инакомыслия путем ареста и преследования членов гражданского общества и критиков ее действий на Украине.	2				ffcde700-153a-46a7-9bf8-06e7f1318667	00024bafed--642fded32d027f1176f9e6db	fdd53e0018709e618b46807dc0a705b4	2023-04-07T09:13:55.643	2023-04-07T09:14:15.770
Еще одна цель заключалась в создании электронной <mark>сети</mark> для ведения международного диалога по вопросам инвестиционной политики и передовой практики.	1				3fc4806f-d4ee-4af9-ab6d-494c82448bde	00024bafed--642fded32d027f1176f9e6db	fdd53e0018709e618b46807dc0a705b4	2023-04-07T09:13:55.643	2023-04-07T09:14:15.770
Однако после начала <mark>восстания</mark> против режима Асада стало практикой фотографировать заключенных, подвергшихся пыткам и убитых во время пребывания в заключении.	3				87ea7b27-4e21-4306-883b-6495d3b4d875	00024bafed--642fded32d027f1176f9e6db	fdd53e0018709e618b46807dc0a705b4	2023-04-07T09:13:55.643	2023-04-07T09:14:15.770
Возможность воздействия инновационных <mark>бизнес</mark>-моделей, реализуемых под руководством женщин, может стать ключом к преобразованию господствующей корпоративной культуры.	2				99bbd4be-d54d-4a78-89e3-efdd9729ff76	00024bafed--642fded32d027f1176f9e6db	fdd53e0018709e618b46807dc0a705b4	2023-04-07T09:13:55.643	2023-04-07T09:14:15.770
Мы вновь обращаем внимание на опасность постоянных провокаций и подстрекательств внутри или вблизи мечети Аль-Акса, которая является первой <<киблой>> и третьей по значимости <mark>святыней</mark> ислама.	3				f3d676f0-a470-41ee-9110-72861049ccfe	00024bafed--642fded32d027f1176f9e6db	fdd53e0018709e618b46807dc0a705b4	2023-04-07T09:13:55.643	2023-04-07T09:14:15.770
55. 14 января 2013 года Юлия <mark>Степанова</mark>, занимающаяся оказанием помощи политическим репрессированным, стала жертвой нападения двух неизвестных, когда возвращалась к себе домой в Минске.	5				acd473ce-cb6e-4b5e-b033-a5f4d749c5a1	00024bafed--642fded32d027f1176f9e6db	fdd53e0018709e618b46807dc0a705b4	2023-04-07T09:13:55.643	2023-04-07T09:14:15.770
Например, согласно законам о коммерческой тайне информация должна представлять собой коммерческую ценность и служить интересам охраны коммерческой тайны, а не <mark>псалмов</mark> или фольклора.	2				49dd771e-63ac-43e0-9957-5979e4984093	00024bafed--642fded32d027f1176f9e6db	fdd53e0018709e618b46807dc0a705b4	2023-04-07T09:13:55.643	2023-04-07T09:14:15.770
Фонд включил в свою программу вопросы прав <mark>человека</mark>, борьбы с торговлей детьми и образования молодежи с целью трудоустройства и открыл представительства в Гане и Либерии.	1				f2451a4d-f280-4d89-ae4c-e3da5b51c52d	00024bafed--642fded32d027f1176f9e6db	fdd53e0018709e618b46807dc0a705b4	2023-04-07T09:13:55.643	2023-04-07T09:14:15.770
5. Комитет, возможно, пожелает рассмотреть предлагаемую форму реестра исключений и принять его на временной <mark>основе</mark> до официального утверждения Конференцией Сторон на ее первом совещании.	2				116d4e47-0f3d-43d3-a8aa-2b4176a02d49	00024bafed--642fded32d027f1176f9e6db	fdd53e0018709e618b46807dc0a705b4	2023-04-07T09:13:55.643	2023-04-07T09:14:15.770
Правом на возмещение ущерба обладают, в частности, лица, необоснованно лишенные свободы вследствие допущенной <mark>ошибки</mark> или противоправной деятельности соответствующего органа (статья 560).	2				3365e881-66fa-4127-af1c-9e664fe79b17	00024bafed--642fded32d027f1176f9e6db	fdd53e0018709e618b46807dc0a705b4	2023-04-07T09:13:55.643	2023-04-07T09:14:15.770
Испытание считается успешно пройденным, если в течение первых 10 минут после подачи проверочного давления на резервуаре под давлением не наблюдается заметной остаточной деформации, видимых признаков <mark>деструкции</mark> и видимой утечки.	4				423b0209-15f6-41c8-add8-1a8572a59d8c	00024bafed--642fded40ebcfb11a8e7ae57	a79b57b706c2d21b108521a531ad7b11	2023-04-07T09:13:56.635	2023-04-07T09:14:18.175
В этой <mark>связи</mark> Правление рассмотрело первый доклад Комитета по контролю за активами и обязательствами Фонда и одобрило содержащиеся в нем выводы.	1				6f06ca50-3f02-4a81-87f4-4b15bec553fb	00024bafed--642fded40ebcfb11a8e7ae57	a79b57b706c2d21b108521a531ad7b11	2023-04-07T09:13:56.635	2023-04-07T09:14:18.175
Организация содействовала достижению цели 3 Целей развития тысячелетия посредством удовлетворения образовательных потребностей молодежи и взрослых в программах, способствующих реализации гражданской позиции и укрепляющих демократические <mark>ценности</mark>.	1				d24e10c5-2f01-4b57-bd82-792fdbbe0100	00024bafed--642fded40ebcfb11a8e7ae57	a79b57b706c2d21b108521a531ad7b11	2023-04-07T09:13:56.635	2023-04-07T09:14:18.175
Это наводит на <mark>мысль</mark> о том, что некоторые из их отечественных фирм укрепили конкурентные преимущества и для международного производства.	1				322b9257-2ea8-4ff7-afd3-d02d4b40098a	00024bafed--642fded40ebcfb11a8e7ae57	a79b57b706c2d21b108521a531ad7b11	2023-04-07T09:13:56.635	2023-04-07T09:14:18.175
С <mark>заявлением</mark> от имени Группы государств Латинской Америки и Карибского бассейна выступил также представитель Чили.	1				fa5b00e7-d557-4c9c-9665-6e8928bdf545	00024bafed--642fded40ebcfb11a8e7ae57	a79b57b706c2d21b108521a531ad7b11	2023-04-07T09:13:56.635	2023-04-07T09:14:18.175
5,8 (оценка на <mark>средину</mark> года) в среднем за 5-летний период с 2008 по 2013 год.	1				2e79b0ce-b540-428d-a24d-6bac2064de62	00024bafed--642fded40ebcfb11a8e7ae57	a79b57b706c2d21b108521a531ad7b11	2023-04-07T09:13:56.635	2023-04-07T09:14:18.175
Кроме того, центральные <mark>банки</mark> этих стран в качестве одного из важных инструментов уменьшения вероятности непредвиденных ситуаций и регулирования ожиданий рынка применяют практику упреждающего обозначения ориентиров.	1				8eb5e3f2-3fe4-4ef9-bff0-510213e7bf18	00024bafed--642fded40ebcfb11a8e7ae57	a79b57b706c2d21b108521a531ad7b11	2023-04-07T09:13:56.635	2023-04-07T09:14:18.175
5. напоминает бывшей югославской Республике Македония, Норвегии, Республике Молдова, Румынии, Хорватии, Швейцарии и Швеции о <mark>важности</mark> своевременного представления данных с привязкой к сетке;	1				785c0ac5-25e5-481a-9e4f-ee49b4b20d5a	00024bafed--642fded40ebcfb11a8e7ae57	a79b57b706c2d21b108521a531ad7b11	2023-04-07T09:13:56.635	2023-04-07T09:14:18.175
С заявлениями выступили представители Алжира, Мексики, Таиланда, <mark>Кубы</mark>, Индонезии, Китая, Республики Корея, Бразилии, Норвегии, Японии и Соединенных Штатов.	1				14a6d0a0-6399-4296-8e10-1072cb1292e6	00024bafed--642fded40ebcfb11a8e7ae57	a79b57b706c2d21b108521a531ad7b11	2023-04-07T09:13:56.635	2023-04-07T09:14:18.175
Исходя из этого, США постоянно считали захват и господство над Корейским полуостровом ключевым звеном в составлении политики по реализации своей стратегии глобального <mark>господства</mark>.	2				b520261e-a439-4f3c-a8d5-be75e5e373d5	00024bafed--642fded40ebcfb11a8e7ae57	a79b57b706c2d21b108521a531ad7b11	2023-04-07T09:13:56.635	2023-04-07T09:14:18.175
"""2.16 ""Стандартная эталонная испытательная шина"" (СЭИШ) означает шину, которая изготавливается, проверяется и хранится в соответствии со стандартами Американского общества по испытаниям и материалам (<mark>АСТМ</mark>),"	5				ff137835-0983-4c45-a13b-2352662f55c4	00024bafed--642fded52d29fb66b5613ee5	d0f7b56091eb894d625bdc58be04a15a	2023-04-07T09:13:57.583	2023-04-07T09:14:55.836
Оно также нарушает положения статей 12 и 13 Пакта, которые гарантируют свободу передвижения и право на обжалование решения о его высылке с территории страны в компетентном <mark>органе</mark> власти.	2				221902e0-f3a1-449c-947d-9a1056d3e018	00024bafed--642fded52d29fb66b5613ee5	d0f7b56091eb894d625bdc58be04a15a	2023-04-07T09:13:57.583	2023-04-07T09:14:55.836
51. В настоящей записке описана концепция инклюзивной инновационной деятельности и рассмотрен ряд связей и <mark>аспектов</mark>, которые необходимо учитывать, для того чтобы инновационные системы были более благоприятными для инклюзивных инноваций.	4				bcc42bef-2366-40d8-b7b4-f4209c5f4550	00024bafed--642fded52d29fb66b5613ee5	d0f7b56091eb894d625bdc58be04a15a	2023-04-07T09:13:57.583	2023-04-07T09:14:55.836
40. Решение Азербайджана выступить по пункту повестки дня, касающемуся права на самоопределение, носит провокационный характер, учитывая то, что Азербайджан отказывает народу Нагорного <mark>Карабаха</mark> именно в этом праве.	3				eb241d16-aba6-4195-9a28-764e1a7c15a4	00024bafed--642fded52d29fb66b5613ee5	d0f7b56091eb894d625bdc58be04a15a	2023-04-07T09:13:57.583	2023-04-07T09:14:55.836
В случае отсутствия <mark>редактора</mark> ответственность за разработку проекта и регистрацию комментариев и ответов на замечания несет руководитель проекта.	2				a312823e-2e51-4973-b2c6-74c5c0adc971	00024bafed--642fded52d29fb66b5613ee5	d0f7b56091eb894d625bdc58be04a15a	2023-04-07T09:13:57.583	2023-04-07T09:14:55.836
В этой связи в деле искоренения нищеты, обес-<mark>печения</mark> экономического роста и устойчивого развития решающую роль играют женщины, особенно женщины-предприниматели.	4				28cb4a72-b671-401b-ad0b-b340738adc44	00024bafed--642fded52d29fb66b5613ee5	d0f7b56091eb894d625bdc58be04a15a	2023-04-07T09:13:57.583	2023-04-07T09:14:55.836
Матрос парома без <mark>винта</mark>: базовое образование, минимальный опыт работы − полгода практики на соответствующем водном пути.	3				b45c7123-51fb-4bfa-b9a6-984ac070ac5c	00024bafed--642fded52d29fb66b5613ee5	d0f7b56091eb894d625bdc58be04a15a	2023-04-07T09:13:57.583	2023-04-07T09:14:55.836
6. Д-р Эссам аль-Хаддад (далее д-р Аль-Хаддад), 60 лет, родился в <mark>Александрии</mark>, советник по международным вопросам д-ра Мурси.	3				899cde49-218e-47e4-bc8c-7489c017b66f	00024bafed--642fded52d29fb66b5613ee5	d0f7b56091eb894d625bdc58be04a15a	2023-04-07T09:13:57.583	2023-04-07T09:14:55.836
В 2013 году началась работа по использованию экономических инструментов для управления водными ресурсами на региональном уровне в Республике <mark>Бурятия</mark>.	2				163d4630-3dd8-46c9-ad29-d4b6446b342c	00024bafed--642fded52d29fb66b5613ee5	d0f7b56091eb894d625bdc58be04a15a	2023-04-07T09:13:57.583	2023-04-07T09:14:55.836
"3.1.2 ""Калибровка"" означает процесс <mark>настройки</mark> чувствительности системы измерения таким образом, чтобы ее показания соответствовали диапазону эталонных сигналов."	2				65de0bf2-55c0-42bb-9898-98b7314fed92	00024bafed--642fded52d29fb66b5613ee5	d0f7b56091eb894d625bdc58be04a15a	2023-04-07T09:13:57.583	2023-04-07T09:14:55.836
Можно совершенствовать технические способности сити-<mark>менеджеров</mark> и практических специалистов путем обменов между городами с помощью гражданского общества, технических центров, институтов и академических кругов, а также посредством привлечения опыта национальных экспертов.	1				ffcf1d40-a99b-4055-bfec-e194b933d053	00024bafed--642fded52d29fb66b5613ef1	91d882064c7ad10400e7cc174beb4ec2	2023-04-07T09:13:57.753	2023-04-07T09:14:22.731
Г-н Маас Гооте является Исполнительным директором Нидерландского отделения Всемирного союза охраны <mark>природы</mark> (МСОП) - крупнейшей в мире сети природоохранных организаций.	1				89e5e599-0aad-4c3d-bf82-f4292e681551	00024bafed--642fded52d29fb66b5613ef1	91d882064c7ad10400e7cc174beb4ec2	2023-04-07T09:13:57.753	2023-04-07T09:14:22.731
Хотя правительство Мьянмы неоднократно решительно заявляло о мерах, которые будут приниматься в отношении лиц, совершающих акты насилия, эти заявления не были с достаточной твердостью доведены до сведения населения на <mark>периферии</mark>.	5				82f329cd-05da-4cd1-bb7b-ddb613dbf966	00024bafed--642fded52d29fb66b5613ef1	91d882064c7ad10400e7cc174beb4ec2	2023-04-07T09:13:57.753	2023-04-07T09:14:22.731
Использование новых технологий, таких как мобильные <mark>деньги</mark>, и инновационных бизнес-моделей продемонстрировало большие возможности обхода и преодоления препятствий для доступа.	1				d95f4353-8953-4c9c-be23-06b2812f4f7f	00024bafed--642fded52d29fb66b5613ef1	91d882064c7ad10400e7cc174beb4ec2	2023-04-07T09:13:57.753	2023-04-07T09:14:22.731
Цель настоящего <mark>меморандума</mark> состоит в том, чтобы указать нынешний состав Международного Суда и изложить процедуру выборов в Генеральной Ассамблее и Совете Безопасности.	5				a795c890-9d1c-40e4-926a-8565158bd927	00024bafed--642fded52d29fb66b5613ef1	91d882064c7ad10400e7cc174beb4ec2	2023-04-07T09:13:57.753	2023-04-07T09:14:22.731
Было высказано мнение о нецелесообразности безоговорочного одобрения модели финансирования; вместо этого УНП ООН в рамках тесных консультаций с <mark>государствами</mark>-членами следует продолжить контролировать и анализировать ход внедрения этой модели.	1				a4e11a6d-7e8b-4029-ad91-a7ac9e715934	00024bafed--642fded52d29fb66b5613ef1	91d882064c7ad10400e7cc174beb4ec2	2023-04-07T09:13:57.753	2023-04-07T09:14:22.731
"122.139, 122.140, 122.145, 122.150 Сообщить о судьбе всех политических заключенных, в частности членов ""группы 15"", и освободить их (Джибути, Испания, <mark>Франция</mark>, США)."	1				ddb52ecc-c992-452f-81bf-53f0b91d78e9	00024bafed--642fded52d29fb66b5613ef1	91d882064c7ad10400e7cc174beb4ec2	2023-04-07T09:13:57.753	2023-04-07T09:14:22.731
Чтобы придать <mark>агрессии</mark> видимость законности, выбивают нужные резолюции из международных организаций, а если по каким-то причинам этого не получается, вовсе игнорируют и Совет Безопасности ООН, и ООН в целом.	1				e70cbc14-cad4-4295-b27d-4ef6c0b5acdb	00024bafed--642fded52d29fb66b5613ef1	91d882064c7ad10400e7cc174beb4ec2	2023-04-07T09:13:57.753	2023-04-07T09:14:22.731
(a) учетом потребностей и возможностей (напр., знание <mark>языков</mark>, грамотность, доступ к Интернету, географическое местоположение (город/село), мобильность) заинтересованной общественности, чтобы она могла эффективно участвовать в процедуре;	1				1dec16c6-fff7-4a03-9cc9-1fdf3170c549	00024bafed--642fded52d29fb66b5613ef1	91d882064c7ad10400e7cc174beb4ec2	2023-04-07T09:13:57.753	2023-04-07T09:14:22.731
79. Словения отметила, что принятый в 2013 году закон о декриминализации абортов в первые три месяца беременности стал важной <mark>вехой</mark> в деле защиты прав женщин.	3				67c8e342-b370-4927-96f2-fd4dfb3872b8	00024bafed--642fded52d29fb66b5613ef1	91d882064c7ad10400e7cc174beb4ec2	2023-04-07T09:13:57.753	2023-04-07T09:14:22.731
