INPUT:text	OUTPUT:complexity	GOLDEN:complexity	HINT:text	HINT:default_language	ASSIGNMENT:task_id	ASSIGNMENT:assignment_id	ASSIGNMENT:worker_id	ASSIGNMENT:started	ASSIGNMENT:submitted
Секретариат будет регулярно представлять Совету доклады о достигнутом прогрессе вместе с <mark>рекомендациями</mark> относительно любых корректировок графика уничтожения, при необходимости.	2				495cc4aa-5f3b-4a3d-8c06-a41a82b486f6	00024bafed--642fdf0ddef02f6cb266db91	44d7d24256edbe515301aee5c6397767	2023-04-07T09:14:53.913	2023-04-07T09:15:24.867
Расстояние между внутренними краями задних светоотражающих приспособлений должно быть не менее 300 мм, а вертикальный <mark>угол</mark> видимости между ними должен составлять 15° над горизонталью.	1				7fbd96f6-422e-4ed2-ad11-20d788e35e52	00024bafed--642fdf0ddef02f6cb266db91	44d7d24256edbe515301aee5c6397767	2023-04-07T09:14:53.913	2023-04-07T09:15:24.867
В связи с различными вопросами поднималась тема обеспечения равенства между <mark>мужчинами</mark> и женщинами, в том числе в связи с числом мужчин и женщин в Канцелярии Председателя Генеральной Ассамблеи.	1				81ea741a-4042-4dde-abfa-4d2a83b073c6	00024bafed--642fdf0f5986385871da3bfb	91c86cae3be6aa1d5cffb7a56adb663e	2023-04-07T09:14:55.593	2023-04-07T09:15:07.503
a) ознакомления региональных и местных субъектов и их социальных партнеров с соответствующим законодательством и его <mark>популяризации</mark> в их среде;	1				5594698f-4976-4292-a884-424a9b7ed8c3	00024bafed--642fdf0f5986385871da3bfb	91c86cae3be6aa1d5cffb7a56adb663e	2023-04-07T09:14:55.593	2023-04-07T09:15:07.503
5) <mark>Коды</mark> типов транспортных средств в рамках внутреннего судоходства указаны в рекомендации № 28 ЕЭК ООН (приложение 4.1).	1				bf98a99b-789c-4451-9d20-0a30fe132ab4	00024bafed--642fdf0f5986385871da3bfb	91c86cae3be6aa1d5cffb7a56adb663e	2023-04-07T09:14:55.593	2023-04-07T09:15:07.503
Основная ответственность семей заключается в обеспечении детям ухода и защиты в атмосфере счастья, <mark>любви</mark> и взаимопонимания, и потому любые инициативы по защите детей должны быть ориентированы на интересы семьи.	1				5668d13d-7b15-4026-938f-714d09848ef4	00024bafed--642fdf0f5986385871da3bfb	91c86cae3be6aa1d5cffb7a56adb663e	2023-04-07T09:14:55.593	2023-04-07T09:15:07.503
6. Молодая женщина теряет контроль над своим транспортным средством после обгона другого автомобиля на скоростном <mark>шоссе</mark>, в результате чего автомобиль заносит и он ударяется об ограждение на разделительной полосе.	1				9bbc4abf-981c-46ad-b792-ed3794987d63	00024bafed--642fdf0f5986385871da3bfb	91c86cae3be6aa1d5cffb7a56adb663e	2023-04-07T09:14:55.593	2023-04-07T09:15:07.503
3.4.5.7.3 В системах UFM без теплообменника для повышения температуры калибровочного <mark>воздуха</mark> должен использоваться нагреватель; затем система стабилизируется, и со всех приборов снимают показания.	1				606a1eff-4a14-4003-a770-b172bf9b12a0	00024bafed--642fdf0f5986385871da3bfb	91c86cae3be6aa1d5cffb7a56adb663e	2023-04-07T09:14:55.593	2023-04-07T09:15:07.503
На <mark>слайде</mark> вы хорошо видите, что 15 июля работало 7 станций, 16 июля - 8, а 17 июля их было уже 9.	1				23faee0f-ceff-4e09-b39e-bac24abd8804	00024bafed--642fdf0f5986385871da3bfb	91c86cae3be6aa1d5cffb7a56adb663e	2023-04-07T09:14:55.593	2023-04-07T09:15:07.503
Уголовная ответственность в отношении юридических лиц не применяется, что не наносит ущерба индивидуальной уголовной ответственности тех представителей, которые совершают свои действия через посредство юридического <mark>лица</mark>.	1				362cff88-ae93-47bc-a899-1a24df5bce6f	00024bafed--642fdf0f5986385871da3bfb	91c86cae3be6aa1d5cffb7a56adb663e	2023-04-07T09:14:55.593	2023-04-07T09:15:07.503
8.4.7.2 разгибают левую ногу без перемещения бедра по подушке сиденья и <mark>подошву</mark> ступни устанавливают на опоре для ног.	1				60a6dd1d-5633-4fc3-821f-055bb12e841b	00024bafed--642fdf0f5986385871da3bfb	91c86cae3be6aa1d5cffb7a56adb663e	2023-04-07T09:14:55.593	2023-04-07T09:15:07.503
В разных контекстах и сотрудники консульских учреждений, и государственные <mark>нотариусы</mark>, и председатели судов, и национальные суды считались органами, которые обладают компетенцией для удостоверения подлинности.	1				a86122f2-60a2-474d-afbf-170fc994068f	00024bafed--642fdf0f5986385871da3bfb	91c86cae3be6aa1d5cffb7a56adb663e	2023-04-07T09:14:55.593	2023-04-07T09:15:07.503
23. Упрощение процедур торговли должно принести выгоды, сходные с выгодами от снижения ставок <mark>тарифа</mark>, поскольку обременительные таможенные процедуры приводят к увеличению торговых издержек.	2				a3fa8c8e-7e13-46ce-90a2-8684bec130de	00024bafed--642fdf10497bb16fa8905850	2e379ed58971f6a8306ac3c6fa3b2526	2023-04-07T09:14:56.663	2023-04-07T09:15:45.189
В секторе финансовых услуг все страны ВАС взяли на себя обязательства в отношении банковских и страховых услуг, оговорив лишь небольшой набор условий (например, требование постоянного проживания для банковских <mark>менеджеров</mark>).	2				ebfd485d-e430-4e88-8ab3-8127a0c7b4de	00024bafed--642fdf10497bb16fa8905850	2e379ed58971f6a8306ac3c6fa3b2526	2023-04-07T09:14:56.663	2023-04-07T09:15:45.189
72. КЛРД выразил <mark>беспокойство</mark> в связи с тем, что система выдачи разрешений на работу и квот для найма иностранных работников носит ограничительный характер и может привести к дискриминации.	1				8c05c0b1-ebc7-4ab7-9a1f-8e48c2810ceb	00024bafed--642fdf10497bb16fa8905850	2e379ed58971f6a8306ac3c6fa3b2526	2023-04-07T09:14:56.663	2023-04-07T09:15:45.189
48. В соответствии с этими директивами МИНСВ, его технические партнеры и организации инвалидов совместными усилиями составили Практический справочник по вопросам доступа инвалидов в общественные инфраструктурные <mark>сооружения</mark>, здания и места.	1				06531139-56ac-4bf5-af1c-210eddd12899	00024bafed--642fdf10497bb16fa8905850	2e379ed58971f6a8306ac3c6fa3b2526	2023-04-07T09:14:56.663	2023-04-07T09:15:45.189
b) Конвенция против пыток и других жестоких, бесчеловечных или унижающих достоинство видов обращения или <mark>наказания</mark> -- в 2011 году;	1				3fedb5d2-8ceb-4fde-b9fb-9bcd737d0017	00024bafed--642fdf10497bb16fa8905850	2e379ed58971f6a8306ac3c6fa3b2526	2023-04-07T09:14:56.663	2023-04-07T09:15:45.189
В этой связи важно, чтобы подготовка учителей была адекватной и придавала им чувство уверенности и безопасности в процессе преподавания истории с применением <mark>похода</mark>, позволяющего учитывать различные точки зрения.	3				74e097e4-2e17-4a3b-b00a-95fc176be52d	00024bafed--642fdf10497bb16fa8905850	2e379ed58971f6a8306ac3c6fa3b2526	2023-04-07T09:14:56.663	2023-04-07T09:15:45.189
"v) подготовил документальный фильм ""Фемицид, <mark>страсть</mark> или контроль"", в котором анализируется ответственность средств массовой информации в ходе уголовного судопроизводства;"	1				8dd6ed23-7e75-4086-986b-0546dfe18035	00024bafed--642fdf10497bb16fa8905850	2e379ed58971f6a8306ac3c6fa3b2526	2023-04-07T09:14:56.663	2023-04-07T09:15:45.189
Речь идет о многочисленных случаях изнасилований, в том числе групповых, принуждения к браку, сексуального <mark>рабства</mark> и физических издевательств над женщинами и девочками.	1				d5351e10-ecdf-45f7-ae02-f4fd0a028a95	00024bafed--642fdf10497bb16fa8905850	2e379ed58971f6a8306ac3c6fa3b2526	2023-04-07T09:14:56.663	2023-04-07T09:15:45.189
Основные публикации Организации Объединенных Наций: <<Глобальная перспектива в области биоразнообразия>>, <<Мировое экономическое положение и перспективы>>, <<Устойчивое развитие в XXI <mark>веке</mark>>>	1				1256ae32-0ba9-4b2d-9834-831c0f5783ab	00024bafed--642fdf10497bb16fa8905850	2e379ed58971f6a8306ac3c6fa3b2526	2023-04-07T09:14:56.663	2023-04-07T09:15:45.189
"Фонд ""Лордина"" ведет строительство Института по <mark>овладению</mark> профессиональными навыками для лиц, содержащихся в лагере в Гамбаге, и жителей окрестных общин."	2				251200c7-b2b6-4d99-b0bb-2c0199fd36c3	00024bafed--642fdf10497bb16fa8905850	2e379ed58971f6a8306ac3c6fa3b2526	2023-04-07T09:14:56.663	2023-04-07T09:15:45.189
23. Упрощение процедур торговли должно принести выгоды, сходные с выгодами от снижения ставок <mark>тарифа</mark>, поскольку обременительные таможенные процедуры приводят к увеличению торговых издержек.	1				a3fa8c8e-7e13-46ce-90a2-8684bec130de	00024bafed--642fdf12def02f6cb266dbf7	9f223b0a97d33a0c598926ac4e84d684	2023-04-07T09:14:58.630	2023-04-07T09:16:22.533
В секторе финансовых услуг все страны ВАС взяли на себя обязательства в отношении банковских и страховых услуг, оговорив лишь небольшой набор условий (например, требование постоянного проживания для банковских <mark>менеджеров</mark>).	1				ebfd485d-e430-4e88-8ab3-8127a0c7b4de	00024bafed--642fdf12def02f6cb266dbf7	9f223b0a97d33a0c598926ac4e84d684	2023-04-07T09:14:58.630	2023-04-07T09:16:22.533
72. КЛРД выразил <mark>беспокойство</mark> в связи с тем, что система выдачи разрешений на работу и квот для найма иностранных работников носит ограничительный характер и может привести к дискриминации.	1				8c05c0b1-ebc7-4ab7-9a1f-8e48c2810ceb	00024bafed--642fdf12def02f6cb266dbf7	9f223b0a97d33a0c598926ac4e84d684	2023-04-07T09:14:58.630	2023-04-07T09:16:22.533
48. В соответствии с этими директивами МИНСВ, его технические партнеры и организации инвалидов совместными усилиями составили Практический справочник по вопросам доступа инвалидов в общественные инфраструктурные <mark>сооружения</mark>, здания и места.	1				06531139-56ac-4bf5-af1c-210eddd12899	00024bafed--642fdf12def02f6cb266dbf7	9f223b0a97d33a0c598926ac4e84d684	2023-04-07T09:14:58.630	2023-04-07T09:16:22.533
b) Конвенция против пыток и других жестоких, бесчеловечных или унижающих достоинство видов обращения или <mark>наказания</mark> -- в 2011 году;	1				3fedb5d2-8ceb-4fde-b9fb-9bcd737d0017	00024bafed--642fdf12def02f6cb266dbf7	9f223b0a97d33a0c598926ac4e84d684	2023-04-07T09:14:58.630	2023-04-07T09:16:22.533
В этой связи важно, чтобы подготовка учителей была адекватной и придавала им чувство уверенности и безопасности в процессе преподавания истории с применением <mark>похода</mark>, позволяющего учитывать различные точки зрения.	4				74e097e4-2e17-4a3b-b00a-95fc176be52d	00024bafed--642fdf12def02f6cb266dbf7	9f223b0a97d33a0c598926ac4e84d684	2023-04-07T09:14:58.630	2023-04-07T09:16:22.533
"v) подготовил документальный фильм ""Фемицид, <mark>страсть</mark> или контроль"", в котором анализируется ответственность средств массовой информации в ходе уголовного судопроизводства;"	2				8dd6ed23-7e75-4086-986b-0546dfe18035	00024bafed--642fdf12def02f6cb266dbf7	9f223b0a97d33a0c598926ac4e84d684	2023-04-07T09:14:58.630	2023-04-07T09:16:22.533
Речь идет о многочисленных случаях изнасилований, в том числе групповых, принуждения к браку, сексуального <mark>рабства</mark> и физических издевательств над женщинами и девочками.	1				d5351e10-ecdf-45f7-ae02-f4fd0a028a95	00024bafed--642fdf12def02f6cb266dbf7	9f223b0a97d33a0c598926ac4e84d684	2023-04-07T09:14:58.630	2023-04-07T09:16:22.533
Основные публикации Организации Объединенных Наций: <<Глобальная перспектива в области биоразнообразия>>, <<Мировое экономическое положение и перспективы>>, <<Устойчивое развитие в XXI <mark>веке</mark>>>	1				1256ae32-0ba9-4b2d-9834-831c0f5783ab	00024bafed--642fdf12def02f6cb266dbf7	9f223b0a97d33a0c598926ac4e84d684	2023-04-07T09:14:58.630	2023-04-07T09:16:22.533
"Фонд ""Лордина"" ведет строительство Института по <mark>овладению</mark> профессиональными навыками для лиц, содержащихся в лагере в Гамбаге, и жителей окрестных общин."	1				251200c7-b2b6-4d99-b0bb-2c0199fd36c3	00024bafed--642fdf12def02f6cb266dbf7	9f223b0a97d33a0c598926ac4e84d684	2023-04-07T09:14:58.630	2023-04-07T09:16:22.533
В Доминиканской Республике ЮНКТАД участвовала в августе 2012 года в двухдневном семинаре с ассоциациями <mark>потребителей</mark>, организованном Доминиканским агентством по защите прав потребителей.	2				1957d3f7-7e3d-446d-abf4-a6838d0de01f	00024bafed--642fdf130ebcfb11a8e7b867	d0f7b56091eb894d625bdc58be04a15a	2023-04-07T09:14:59.248	2023-04-07T09:16:34.894
25 февраля 2014 года был поврежден один из автомобилей посольства, с заднего сиденья которого была также похищена <mark>сумка</mark>.	2				fa4a5efb-cbff-4cc8-b872-c42ca21234e2	00024bafed--642fdf130ebcfb11a8e7b867	d0f7b56091eb894d625bdc58be04a15a	2023-04-07T09:14:59.248	2023-04-07T09:16:34.894
На рисунке показаны два примера − а) и b) − возможных способов <mark>блокировки</mark> храповика или храпового механизма.	2				92f512c5-bbbe-40b8-9e07-1487c2bb550d	00024bafed--642fdf130ebcfb11a8e7b867	d0f7b56091eb894d625bdc58be04a15a	2023-04-07T09:14:59.248	2023-04-07T09:16:34.894
Информация о количестве дел (гражданских и уголовных), находящихся на рассмотрении (или ожидающих рассмотрения) судов Англии и Уэльса, <mark>Шотландии</mark> и Северной Ирландии, в настоящее время отсутствует	3				61a14a05-f4bf-412b-b19a-b032c2058d40	00024bafed--642fdf130ebcfb11a8e7b867	d0f7b56091eb894d625bdc58be04a15a	2023-04-07T09:14:59.248	2023-04-07T09:16:34.894
Комитет также рекомендует государству-участнику оказывать бабушкам и <mark>дедушкам</mark> или другим родственникам достаточную поддержку и обеспечить, чтобы такие дети не подвергались надругательствам и насилию.	2				ef46c03d-cc8b-46cb-a7df-c813c8d63fa8	00024bafed--642fdf130ebcfb11a8e7b867	d0f7b56091eb894d625bdc58be04a15a	2023-04-07T09:14:59.248	2023-04-07T09:16:34.894
277. Комиссия напомнила о соображениях, принимаемых во внимание ее секретариатом при отборе кандидатов на прохождение <mark>стажировки</mark>.	3				938246ac-5d1f-410f-96df-1c933168661d	00024bafed--642fdf130ebcfb11a8e7b867	d0f7b56091eb894d625bdc58be04a15a	2023-04-07T09:14:59.248	2023-04-07T09:16:34.894
36. Г-жа <mark>Руин</mark> (Коста-Рика) говорит, что международное сообщество должно воспользоваться динамикой момента, которому дала толчок Всемирная конференция, для ускорения процесса реализации задач, поставленных в Декларации и в итоговом документе.	4				cd1875c3-90dc-4de5-b2a3-e1e3fbe99a9a	00024bafed--642fdf130ebcfb11a8e7b867	d0f7b56091eb894d625bdc58be04a15a	2023-04-07T09:14:59.248	2023-04-07T09:16:34.894
78. Г-н ди Агиар <mark>Патриота</mark> (Бразилия) говорит, что чрезвычайно важно передать суть настоящей предметной дискуссии и использовать ее для развития будущих обсуждений проблемы реструктуризации задолженности.	5				3a7be765-ea0c-41f4-8c3c-c8c70f81572b	00024bafed--642fdf130ebcfb11a8e7b867	d0f7b56091eb894d625bdc58be04a15a	2023-04-07T09:14:59.248	2023-04-07T09:16:34.894
Оперативное морское соединение ВСООНЛ продолжает выполнять свой двойной мандат, предусматривающий блокирование <mark>подступов</mark> к районам морских операций и обучение личного состава военно-морских сил Ливана.	3				23ef369c-f8c7-4d87-8a8b-05adea63a952	00024bafed--642fdf130ebcfb11a8e7b867	d0f7b56091eb894d625bdc58be04a15a	2023-04-07T09:14:59.248	2023-04-07T09:16:34.894
"43. Свобода религии является неотъемлемой частью свободы убеждений и гарантируется статьей 35 Конституции Кувейта, которая гласит: ""Свобода <mark>веры</mark> абсолютна."	3				ed585729-3464-4ca9-9c03-696be96ebb94	00024bafed--642fdf130ebcfb11a8e7b867	d0f7b56091eb894d625bdc58be04a15a	2023-04-07T09:14:59.248	2023-04-07T09:16:34.894
128. В структуре боливийской полиции был создан специальный <mark>наряд</mark> по борьбе с насилием; также были учреждены специальные суды и прокуратуры по вопросам насилия в отношении женщин.	1				2cd183a3-0360-4d58-b6d3-8ecb34ec3c19	00024bafed--642fdf132d027f1176f9ee72	91d882064c7ad10400e7cc174beb4ec2	2023-04-07T09:14:59.752	2023-04-07T09:15:12.977
В 2012 году для осуществления целого ряда проектов развития инфраструктуры Тибета было выделено 929 млн. юаней, построено жилье для 596 000 семей <mark>крестьян</mark> и скотоводов.	1				999ef479-402b-4b86-abf2-d984bbd11bdc	00024bafed--642fdf132d027f1176f9ee72	91d882064c7ad10400e7cc174beb4ec2	2023-04-07T09:14:59.752	2023-04-07T09:15:12.977
Минимальная точность <mark>преобразователя</mark> тока (т.е. датчика тока без оборудования для приема данных) должна соответствовать требованиям пункта 2.1.1 добавления 2 к приложению 6.	1				2aa77886-afa5-43e4-a497-74032859ce3d	00024bafed--642fdf132d027f1176f9ee72	91d882064c7ad10400e7cc174beb4ec2	2023-04-07T09:14:59.752	2023-04-07T09:15:12.977
:: нехватка сведений о прилове морских млекопитающих, <mark>черепах</mark> и морских птиц, особенно в странах Африки	1				2b4b87ec-6937-46de-9e7c-134f17079c33	00024bafed--642fdf132d027f1176f9ee72	91d882064c7ad10400e7cc174beb4ec2	2023-04-07T09:14:59.752	2023-04-07T09:15:12.977
Доклад о ходе работы над тематической оценкой взаимосвязи между водой, продовольствием, <mark>энергией</mark> и экосистемами (ECE/MP.WAT/WG.1/2014/6)	1				852595e1-f0ad-47a8-bd36-eb08bbd540b1	00024bafed--642fdf132d027f1176f9ee72	91d882064c7ad10400e7cc174beb4ec2	2023-04-07T09:14:59.752	2023-04-07T09:15:12.977
Для подготовки следующего поколения поставщиков медицинских услуг на международной арене необходимо углублять их <mark>знания</mark> и повышать их квалификацию, необходимую для продвижения в области глобального здравоохранения и глобального управления.	1				4a7340ea-5487-4910-9643-a18909e76e11	00024bafed--642fdf132d027f1176f9ee72	91d882064c7ad10400e7cc174beb4ec2	2023-04-07T09:14:59.752	2023-04-07T09:15:12.977
Они напомнили, что без существенной международной поддержки и системных изменений многие развивающиеся страны не смогут, скорее всего, достичь ряда этих <mark>целей</mark> к 2015 году.	1				b562bb68-891d-4229-be98-34ad09bc5383	00024bafed--642fdf132d027f1176f9ee72	91d882064c7ad10400e7cc174beb4ec2	2023-04-07T09:14:59.752	2023-04-07T09:15:12.977
МООНСГ продолжает менять свой <mark>размер</mark> и состав, чтобы сократить свое присутствие и постепенно преобразовать крупную миротворческую операцию в меньшую, более целенаправленную миссию по оказанию помощи.	1				29166108-fd05-4d40-943c-0d191c72beb1	00024bafed--642fdf132d027f1176f9ee72	91d882064c7ad10400e7cc174beb4ec2	2023-04-07T09:14:59.752	2023-04-07T09:15:12.977
Какие согласно ВОПОГ положения применяются к электрооборудованию, которое находится на палубе в защищенной зоне сухогрузного судна и не может быть обесточено с помощью <mark>выключателя</mark> на центральном щите?	1				33345f30-589c-4fc2-97e2-dd24617756b6	00024bafed--642fdf132d027f1176f9ee72	91d882064c7ad10400e7cc174beb4ec2	2023-04-07T09:14:59.752	2023-04-07T09:15:12.977
