INPUT:text	OUTPUT:complexity	GOLDEN:complexity	HINT:text	HINT:default_language	ASSIGNMENT:task_id	ASSIGNMENT:assignment_id	ASSIGNMENT:worker_id	ASSIGNMENT:started	ASSIGNMENT:submitted
31. Руководство МООНСДРК и члены дипломатического корпуса указали на необходимость устранения <mark>различий</mark> между бригадой оперативного вмешательства и <<рамочными>> бригадами.	1				d4ea3177-bcb6-4e69-8338-646229fbc5da	00024bb00b--642fdfc0896cfd65ec4c2cb3	ba087610f738571051dcb81fd6443966	2023-04-07T09:17:52.322	2023-04-07T09:18:29.535
Суд заключил, что невоенная, альтернативная, гражданская трудовая служба является компромиссом между конституционным правом на свободу вероисповедания и конституционным долгом по защите <mark>отечества</mark>.	1				d3e92298-b1b7-49d0-bba1-202845077d51	00024bb00b--642fdfc0896cfd65ec4c2cb3	ba087610f738571051dcb81fd6443966	2023-04-07T09:17:52.322	2023-04-07T09:18:29.535
2.4 Автор также сообщает, что 12 января 2010 года ее организация представила заместителю акима <mark>Алматы</mark> на утверждение график мероприятий, которые она запланировала провести в 2015 году.	1				d232dfa6-f335-43ef-b812-5f412dee211d	00024bb00b--642fdfc0bfbe7f7e1c3f0695	945cccc43e0a3ab1759d473a246b03ce	2023-04-07T09:17:52.745	2023-04-07T09:19:09.854
Решив, что он прячет там оружие, <mark>полицейские</mark> изрешетили его пулями, и Атик скончался на месте.	2				1655ae39-8f43-4038-8bb4-5ff3c454c015	00024bb00b--642fdfc0bfbe7f7e1c3f0695	945cccc43e0a3ab1759d473a246b03ce	2023-04-07T09:17:52.745	2023-04-07T09:19:09.854
53. 11 декабря 2013 года Генеральная Ассамблея приняла без голосования резолюции 68/95 A и B, подготовленные на основе доклада Специального комитета (A/68/23) и последующей <mark>рекомендации</mark> Четвертого комитета.	3				a909d2fb-3b6c-4bc8-86a1-801f5ca1f9e8	00024bb00b--642fdfc0bfbe7f7e1c3f0695	945cccc43e0a3ab1759d473a246b03ce	2023-04-07T09:17:52.745	2023-04-07T09:19:09.854
a) восстановление деградировавших экосистем мангровых лесов в Джибути с использованием двух действующих мангровых питомников, каждый из которых производит 6 000 саженцев в каждую <mark>репродукцию</mark>;	4				e47b90bd-085f-4327-9ee7-b6651b39752a	00024bb00b--642fdfc0bfbe7f7e1c3f0695	945cccc43e0a3ab1759d473a246b03ce	2023-04-07T09:17:52.745	2023-04-07T09:19:09.854
"Согласно тому же докладу, объектом нападения <mark>отрядов</mark> ""антибалака"" становились и другие мусульманские общины (в частности, в селениях Бодора и Уам-Бак)."	3				580e3d5f-c562-479a-9088-c9565a490b65	00024bb00b--642fdfc0bfbe7f7e1c3f0695	945cccc43e0a3ab1759d473a246b03ce	2023-04-07T09:17:52.745	2023-04-07T09:19:09.854
По состоянию на 8 апреля помощь в виде основных <mark>товаров</mark> первой необходимости в 2014 году была оказана 1,5 миллиона человек в 13 из 14 мухафаз Сирии.	2				5f3393ae-3e02-4e5f-b125-3a7e4f7f9352	00024bb00b--642fdfc0bfbe7f7e1c3f0695	945cccc43e0a3ab1759d473a246b03ce	2023-04-07T09:17:52.745	2023-04-07T09:19:09.854
За последние десятилетия число женщин, зачисленных в высшие учебные заведения, выросло и составляет сейчас свыше 50 процентов от общего числа <mark>студентов</mark>.	1				fb0b8b8b-3e1c-447e-af60-1b8b6cfd93ea	00024bb00b--642fdfc0bfbe7f7e1c3f0695	945cccc43e0a3ab1759d473a246b03ce	2023-04-07T09:17:52.745	2023-04-07T09:19:09.854
<mark>Исследователи</mark> из Университета Миннесоты обнаружили, что число попыток самоубийства среди подростков возрастает в десять раз в течение шести месяцев после совершенного аборта.	2				0a229dbe-72c9-4f2b-858c-34f327205475	00024bb00b--642fdfc0bfbe7f7e1c3f0695	945cccc43e0a3ab1759d473a246b03ce	2023-04-07T09:17:52.745	2023-04-07T09:19:09.854
Изменения в экспрессии ТГ и генов, связанных со сперматогенезом, наблюдались у взрослых особей и личинок Gobiocyprus rarus после <mark>воздействия</mark> на 0,1-10 мкг БДЭ-209/л.	2				07db1b00-4ecb-4b17-9e7c-48f16f985a65	00024bb00b--642fdfc0bfbe7f7e1c3f0695	945cccc43e0a3ab1759d473a246b03ce	2023-04-07T09:17:52.745	2023-04-07T09:19:09.854
21. Специальная апелляционная группа <mark>Канцелярии</mark> Обвинителя Механизма активно следила за ходом развития событий по делу Воислава Шешеля в ожидании апелляции, подававшейся в Механизм после вынесения решения.	4				0f819fd4-a7c5-46a8-9242-6e818f5828ec	00024bb00b--642fdfc0bfbe7f7e1c3f0695	945cccc43e0a3ab1759d473a246b03ce	2023-04-07T09:17:52.745	2023-04-07T09:19:09.854
Согласно докладу о глобальном гендерном неравенстве (Global Gender Gap Report), который публикуется Всемирным экономическим форумом, Новая Зеландия входит в <mark>десятку</mark> стран, добившихся наибольших успехов в деле улучшения положения женщин.	3				bdcb1ff3-0ebe-45a1-a2fe-e47806898087	00024bb00b--642fdfc0e6d3ce2801c9c052	b5fb952a5adbf119a6501e647c6724bd	2023-04-07T09:17:52.793	2023-04-07T09:18:13.886
В состав рабочей группы должны входить представители правительства (высшие должностные лица) и торговых кругов (<mark>менеджеры</mark> корпораций/компаний, специалисты по логистике...), обладающие признанной репутацией в сфере международного бизнеса.	2				df5d2b89-81ea-46ba-8ac4-aeafa12d3bad	00024bb00b--642fdfc0e6d3ce2801c9c052	b5fb952a5adbf119a6501e647c6724bd	2023-04-07T09:17:52.793	2023-04-07T09:18:13.886
Уважаемые матери и <mark>сестры</mark>, НПО <<Ассоциация содействия иностранцам в Того>> представляет вам информацию по следующим вопросам:	2				662c4156-fa62-4d56-bdd8-144b4cfb7150	00024bb00b--642fdfc0e6d3ce2801c9c052	b5fb952a5adbf119a6501e647c6724bd	2023-04-07T09:17:52.793	2023-04-07T09:18:13.886
Продолжающееся насилие является не просто погрешением против плана <mark>Господа</mark> собрать под крылом единства всех своих разобщенных чад.	3				a09776ea-5874-4121-83e3-3b37bcb4824b	00024bb00b--642fdfc0e6d3ce2801c9c052	b5fb952a5adbf119a6501e647c6724bd	2023-04-07T09:17:52.793	2023-04-07T09:18:13.886
5.2 Определение давления в <mark>шинах</mark> при его снижении по причине какого-либо происшествия (испытание на пробой)	3				f58da189-4159-489f-8dc4-5a41034689ac	00024bb00b--642fdfc0e6d3ce2801c9c052	b5fb952a5adbf119a6501e647c6724bd	2023-04-07T09:17:52.793	2023-04-07T09:18:13.886
По данным Центральной избирательной комиссии в следующем году на парламентских выборах в Кыргызстане находящиеся в Российской Федерации мигранты смогут проголосовать только в четырех городах России: Москве, Санкт-Петербурге, <mark>Новосибирске</mark> и Екатеринбурге.	2				b9d6cd9e-7ff4-4e81-bdf0-d174f4465386	00024bb00b--642fdfc0e6d3ce2801c9c052	b5fb952a5adbf119a6501e647c6724bd	2023-04-07T09:17:52.793	2023-04-07T09:18:13.886
Сотрудники органов безопасности снова отказались предоставить автору более точные сведения об обстоятельствах смерти его сына и даже сообщить место его <mark>захоронения</mark>.	3				eb396bcc-c1bd-45a4-9693-9f3796d07354	00024bb00b--642fdfc0e6d3ce2801c9c052	b5fb952a5adbf119a6501e647c6724bd	2023-04-07T09:17:52.793	2023-04-07T09:18:13.886
b) После полной зарядки испытуемого аккумулятора в соответствии с <mark>методом</mark> зарядки, указанным изготовителем, его выдерживают в течение не менее 1 часа, но не более 4 часов.	3				aebef267-3304-4a07-80f3-f23d0ac0d13e	00024bb00b--642fdfc0e6d3ce2801c9c052	b5fb952a5adbf119a6501e647c6724bd	2023-04-07T09:17:52.793	2023-04-07T09:18:13.886
Мотивировка старших руководителей, способная обеспечить принятие ими принципов управления, ориентированного на результаты, зависит от того, признают ли они <mark>ценность</mark> расходования времени и ресурсов на приобретение и использование информации о результатах.	3				08d05695-742b-47f7-af7e-f7d4a7b7d989	00024bb00b--642fdfc0e6d3ce2801c9c052	b5fb952a5adbf119a6501e647c6724bd	2023-04-07T09:17:52.793	2023-04-07T09:18:13.886
Расследованием случаев экономического <mark>мошенничества</mark> и преступлений с использованием личных данных и принятием мер по их предупреждению занимается также Управление по финансовым исследованиям и борьбе с отмыванием денег.	4				2a235463-9c20-4752-837d-c724b0c586b4	00024bb00b--642fdfc0e6d3ce2801c9c052	b5fb952a5adbf119a6501e647c6724bd	2023-04-07T09:17:52.793	2023-04-07T09:18:13.886
Постоянное совершенствование правовой и законодательной базы, создание необходимых условий для либерализации общества и ведения <mark>бизнеса</mark> имели важное значение в последовательном и устойчивом развитии нашей экономики, повышении уровня жизни населения.	1				8d086061-ea1d-497f-88cb-4fc50138eb07	00024bb00b--642fdfc214c7706522df383e	8a4137ddb59d601dd4ac9e017b9770ab	2023-04-07T09:17:54.553	2023-04-07T09:19:30.881
e. подготовка, опубликование и распространение <mark>исследований</mark> и докладов о конкуренции для информирования и предоставления ориентиров промышленности и потребителям;	1				8d05fa83-7d01-49a9-aa3f-0a6557618669	00024bb00b--642fdfc214c7706522df383e	8a4137ddb59d601dd4ac9e017b9770ab	2023-04-07T09:17:54.553	2023-04-07T09:19:30.881
Увеличился доход на <mark>душу</mark> населения, а доля населения, проживающего за чертой бедности, и показатель продовольственной нищеты значительно сократились.	1				7647c112-8f84-4ced-9811-727be6e47d90	00024bb00b--642fdfc214c7706522df383e	8a4137ddb59d601dd4ac9e017b9770ab	2023-04-07T09:17:54.553	2023-04-07T09:19:30.881
Разница частично компенсируется увеличением потребностей в услугах по разминированию на основании нынешнего <mark>Меморандума</mark> о взаимопонимании, заключенного с Управлением Организации Объединенных Наций по обслуживанию проектов.	1				2efd9d02-c13e-4630-9443-eaae64ccc576	00024bb00b--642fdfc214c7706522df383e	8a4137ddb59d601dd4ac9e017b9770ab	2023-04-07T09:17:54.553	2023-04-07T09:19:30.881
m) обеспечить, чтобы велись записи <mark>допросов</mark> и чтобы в них указывалась личность всех лиц, присутствовавших в ходе записи.	1				608b5387-488e-469d-9248-628735b874cb	00024bb00b--642fdfc214c7706522df383e	8a4137ddb59d601dd4ac9e017b9770ab	2023-04-07T09:17:54.553	2023-04-07T09:19:30.881
Этому предшествовала состоявшаяся 1 сентября 2014 года церемония открытия в СанХосе, которую принимал министр иностранных дел Коста-Рики Мануэль А. Гонсалес Санс в присутствии президента Коста-Рики <mark>Луиса</mark> Гильермо Солиса Риверы.	1				c203d784-78d0-415c-96b8-76c7614e466d	00024bb00b--642fdfc214c7706522df383e	8a4137ddb59d601dd4ac9e017b9770ab	2023-04-07T09:17:54.553	2023-04-07T09:19:30.881
Наиболее важным фактором является надлежащее управление, которое играет ключевую роль в обеспечении роста показателей валового внутреннего продукта на <mark>душу</mark> населения, поступлении прямых иностранных инвестиций и влияет на другие экономические факторы.	1				7d24a7d0-200a-4371-948b-742136c160de	00024bb00b--642fdfc214c7706522df383e	8a4137ddb59d601dd4ac9e017b9770ab	2023-04-07T09:17:54.553	2023-04-07T09:19:30.881
Они особо отметили, что в случае продолжения игнорирования сирийскими <mark>властями</mark> резолюции 2139 (2014) эти члены Совета твердо намерены поддержать выполнение этого обязательства.	1				f3962512-9ec8-4295-928c-00c568bf7971	00024bb00b--642fdfc214c7706522df383e	8a4137ddb59d601dd4ac9e017b9770ab	2023-04-07T09:17:54.553	2023-04-07T09:19:30.881
После провозглашения независимости НОАС стала национальной армией, а ее политическое крыло -- Народно-освободительное <mark>движение</mark> Судана (НОДС) -- было преобразовано в правящую партию большинства, которая сформировала первое правительство.	1				dbe216fd-3d7f-46ae-b9aa-35f8d394d14b	00024bb00b--642fdfc214c7706522df383e	8a4137ddb59d601dd4ac9e017b9770ab	2023-04-07T09:17:54.553	2023-04-07T09:19:30.881
e) защита против <mark>повреждений</mark> в ходе транспортировки, погрузки и разгрузки является ненадлежащей, например, есть недостатки упаковки или размещения груза;	1				094aa94b-8ba2-4996-89c8-6854b223ed95	00024bb00b--642fdfc214c7706522df383e	8a4137ddb59d601dd4ac9e017b9770ab	2023-04-07T09:17:54.553	2023-04-07T09:19:30.881
<mark>границу</mark>, еще и автомобильные перевозки или перевозки по внутренним судоходным линиям внутри государства-члена, то применяются настоящие Единые правовые предписания.	1				9bca6388-e49c-47b7-b69d-3f3dfc04e573	00024bb00b--642fdfc214c7706522df3858	a79b57b706c2d21b108521a531ad7b11	2023-04-07T09:17:54.965	2023-04-07T09:19:31.561
<mark>придание</mark> приоритетного значения задаче снижения неравенства между женщинами и мужчинами в рамках демократического подхода в области медицинских услуг;	3				402aa193-8af4-494b-91ef-21494dc4d620	00024bb00b--642fdfc214c7706522df3858	a79b57b706c2d21b108521a531ad7b11	2023-04-07T09:17:54.965	2023-04-07T09:19:31.561
Его смерть не была официально подтверждена, <mark>тело</mark> не было передано семье, как и не было указано никакого места захоронения для его возможной эксгумации.	1				e118cdd1-9911-4d60-8993-28830d156a69	00024bb00b--642fdfc214c7706522df3858	a79b57b706c2d21b108521a531ad7b11	2023-04-07T09:17:54.965	2023-04-07T09:19:31.561
Депутаты <<Свободы>> с помощью <mark>кулаков</mark> выясняли у генерального директора Национальной телекомпании Украины Александра Пантелеймонова, почему телеканал транслировал подписание акта о принятии Крыма в состав России	2				70fcf609-e1f6-417a-bea3-0abefedda170	00024bb00b--642fdfc214c7706522df3858	a79b57b706c2d21b108521a531ad7b11	2023-04-07T09:17:54.965	2023-04-07T09:19:31.561
С целью определения эффективности коммуникационной и информационнопропагандисткой стратегии на основных <mark>стадиях</mark> кампании по мере ее развертывания можно было бы проводить целенаправленные групповые обсуждения.	2				d63ab447-e839-4464-9cb5-a26d71580774	00024bb00b--642fdfc214c7706522df3858	a79b57b706c2d21b108521a531ad7b11	2023-04-07T09:17:54.965	2023-04-07T09:19:31.561
Этот <mark>резерв</mark> формируется за счет чистой разницы между общей суммой взносов из источника финансирования работающих сотрудников и выплатами, произведенными сотрудникам в связи с прекращением службы или выходом на пенсию.	3				ba98a834-dcda-4c32-9c89-1ef699d1268b	00024bb00b--642fdfc214c7706522df3858	a79b57b706c2d21b108521a531ad7b11	2023-04-07T09:17:54.965	2023-04-07T09:19:31.561
В ходе первого мероприятия аудитории были представлены два специальных пропагандиста и были объявлены имена победителей конкурса <<<mark>Поэзия</mark> на благо мира>>.	1				2668ea67-be28-42d0-a9c5-5a2b47d5fda3	00024bb00b--642fdfc214c7706522df3858	a79b57b706c2d21b108521a531ad7b11	2023-04-07T09:17:54.965	2023-04-07T09:19:31.561
10. <mark>Катар</mark> разрабатывает более углубленный и детальный подход к оценке уровня общественного благосостояния, который традиционно измерялся исключительно в плане роста доходов.	4				554734cb-0c75-418d-8e0e-22c945d8af03	00024bb00b--642fdfc214c7706522df3858	a79b57b706c2d21b108521a531ad7b11	2023-04-07T09:17:54.965	2023-04-07T09:19:31.561
Группа из семи агентов, вооруженных табельным оружием, которое могут иметь при себе лишь военнослужащие, проникла в помещение, выбив <mark>дверь</mark> и сломав замок.	1				75033495-a304-4d1c-acaa-54469346fc31	00024bb00b--642fdfc214c7706522df3858	a79b57b706c2d21b108521a531ad7b11	2023-04-07T09:17:54.965	2023-04-07T09:19:31.561
Он напоминает о своем Замечании общего порядка № 20 по статье 7, в котором государствам-участникам рекомендуется принять положение, запрещающее содержание под стражей без связи с внешним <mark>миром</mark>.	1				9ca6668b-1a37-4d9b-9508-ddb336d230db	00024bb00b--642fdfc214c7706522df3858	a79b57b706c2d21b108521a531ad7b11	2023-04-07T09:17:54.965	2023-04-07T09:19:31.561
Дополнительный протокол является неотъемлемым элементом системы гарантий МАГАТЭ и вместе с дополнительным протоколом составляет в настоящее время стандарт <mark>проверки</mark>, предусмотренной в пункте 1 статьи III Договора.	1				b3e29715-302d-4368-9c37-f070e9a021ac	00024bb00b--642fdfc2e6d3ce2801c9c09c	ffc1275e59e3236a10ce96555fa48bdf	2023-04-07T09:17:54.322	2023-04-07T09:18:17.417
6. подтверждает, что основой устойчивого развития на всех уровнях является транспарентное и подотчетное управление с участием всех заинтересованных сторон, а также профессиональное, этичное, гибкое и обеспеченное информационно-коммуникационными технологиями государственное <mark>администрирование</mark>;	2				220baf92-5630-4651-bc5d-35a6b6b00a2b	00024bb00b--642fdfc2e6d3ce2801c9c09c	ffc1275e59e3236a10ce96555fa48bdf	2023-04-07T09:17:54.322	2023-04-07T09:18:17.417
Чаще происходили взрывы начиненных <mark>взрывчаткой</mark> автомобилей, в том числе, в некоторых случаях, в исключительно гражданских районах.	1				e2f12003-9ff4-48dd-8803-20c094646f38	00024bb00b--642fdfc2e6d3ce2801c9c09c	ffc1275e59e3236a10ce96555fa48bdf	2023-04-07T09:17:54.322	2023-04-07T09:18:17.417
В связи с этим г-жа Колева обращается к правительствам с просьбой о поддержке формального и неформального образования, в рамках которого особое <mark>внимание</mark> уделялось бы развитию предпринимательских и управленческих навыков.	1				c4c40ef3-638d-48af-9e12-62649049296b	00024bb00b--642fdfc2e6d3ce2801c9c09c	ffc1275e59e3236a10ce96555fa48bdf	2023-04-07T09:17:54.322	2023-04-07T09:18:17.417
Книги, схемы и рисунки или аудиовизуальные средства (<mark>кинофильмы</mark> или диапозитивы) должны, по возможности, представлять ситуацию в том виде, в котором она видна с места водителя транспортного средства.	1				7a4a023e-4bab-453c-87ab-a22bc7d9165c	00024bb00b--642fdfc2e6d3ce2801c9c09c	ffc1275e59e3236a10ce96555fa48bdf	2023-04-07T09:17:54.322	2023-04-07T09:18:17.417
В случае нечеткой маркировки или разделения <mark>посадок</mark> одной и той же разновидности различных классов посадка будет понижена до уровня нижнего из двух классов.	2				c7896a1e-6f79-4b9e-947e-36645685954c	00024bb00b--642fdfc2e6d3ce2801c9c09c	ffc1275e59e3236a10ce96555fa48bdf	2023-04-07T09:17:54.322	2023-04-07T09:18:17.417
"жесткий макет флага ""A"" Международного свода сигналов высотой не менее 1 м, расположенный в надлежащем месте на высоте, на которой он виден днем и <mark>ночью</mark> со всех сторон."	1				ae00bf67-7647-42aa-8bed-45c6fa538e57	00024bb00b--642fdfc2e6d3ce2801c9c09c	ffc1275e59e3236a10ce96555fa48bdf	2023-04-07T09:17:54.322	2023-04-07T09:18:17.417
Проблема такого <mark>масштаба</mark> способна свести к нулю значимость повесток дня в области развития, принятых странами Юга, причем не только в Латинской Америке, но и в других регионах мира.	1				5a0093c2-8da1-4337-8f0a-7254245ff66a	00024bb00b--642fdfc2e6d3ce2801c9c09c	ffc1275e59e3236a10ce96555fa48bdf	2023-04-07T09:17:54.322	2023-04-07T09:18:17.417
