INPUT:text	OUTPUT:complexity	GOLDEN:complexity	HINT:text	HINT:default_language	ASSIGNMENT:task_id	ASSIGNMENT:assignment_id	ASSIGNMENT:worker_id	ASSIGNMENT:started	ASSIGNMENT:submitted
Генеральная Ассамблея должна изучить положение, сложившееся в результате использования парниковых газов и ядерной радиации, которое равнозначно нарушению права на <mark>жизнь</mark>.	1				1d3bc80a-fe39-4ac1-b174-a72914593ea0	00024bafed--642fdc4bdc4be92e38c38196	19e16d466b467cbd0189343851128806	2023-04-07T09:03:07.587	2023-04-07T09:03:28.036
Материалы с изображением сексуального насилия над детьми могут иметь самую разную форму - фотографий, негативов, <mark>слайдов</mark>, журналов, книг, рисунков, кино- и видеофильмов, компьютерных дисков и файлов.	3				86bd928f-7418-4cbb-ab61-f15652a57f54	00024bafed--642fdc4bdc4be92e38c38196	19e16d466b467cbd0189343851128806	2023-04-07T09:03:07.587	2023-04-07T09:03:28.036
2. Временный Председатель напоминает, что на Совещании 2013 года Высоких Договаривающихся Сторон Председателем Совещания 2014 года Высоких Договаривающихся Сторон Конвенции было решено назначить посла <mark>Польши</mark>	1				f552053a-ca87-4d87-8d96-81329e3e7322	00024bafed--642fdc4bdc4be92e38c38196	19e16d466b467cbd0189343851128806	2023-04-07T09:03:07.587	2023-04-07T09:03:28.036
"96. Иногда заведен такой порядок, при котором власти либо перекладывают повседневные функции, связанные с функционированием тюрем, на ряд ""тюремных <mark>авторитетов</mark>"" и так называемых ""старших по камерам"", либо попустительствуют действиям паханов."	1				6563c374-d1ae-4b4a-9150-b6f60d4a2cd0	00024bafed--642fdc4bdc4be92e38c38196	19e16d466b467cbd0189343851128806	2023-04-07T09:03:07.587	2023-04-07T09:03:28.036
Под угрозами его заставили зачитать на <mark>видеокамеру</mark> неизвестный ему текст на украинском языке, а также подписать документы о том, что он готов работать на Службу безопасности Украины.	1				a8980c88-cfd8-42b0-a7bf-96a13f343865	00024bafed--642fdc4bdc4be92e38c38196	19e16d466b467cbd0189343851128806	2023-04-07T09:03:07.587	2023-04-07T09:03:28.036
15A - 11.4 Сечение наибольшего диаметра гика должно находиться на 2/3 длины гика, считая от <mark>мачты</mark>.	2				e0e3d3b2-7849-479e-a590-b630d56d9268	00024bafed--642fdc4bdc4be92e38c38196	19e16d466b467cbd0189343851128806	2023-04-07T09:03:07.587	2023-04-07T09:03:28.036
<mark>Суммирование</mark> показателей всех отраслей дает объем ВВП в базовых ценах, а объем ВВП в рыночных ценах рассчитывается путем прибавления к ВВП в базовых ценах налогов за вычетом субсидий на продукты.	1				38c0c16f-4800-406a-a13c-9483e0507076	00024bafed--642fdc4bdc4be92e38c38196	19e16d466b467cbd0189343851128806	2023-04-07T09:03:07.587	2023-04-07T09:03:28.036
67. На встрече в кафедральном <mark>соборе</mark> Сувы, Фиджи, лидеры всех основных религиозных конфессий однозначно заявили, что нет никаких религиозных или культурных оснований для совершения актов насилия в отношении женщин.	1				3b81759b-4012-4737-bb10-9d470457c7a1	00024bafed--642fdc4bdc4be92e38c38196	19e16d466b467cbd0189343851128806	2023-04-07T09:03:07.587	2023-04-07T09:03:28.036
Произошедшие 27 января 2014 года арест и задержание Оливера <mark>Ивановича</mark>, претендента на должность мэра Северной Митровицы из числа косовских сербов, также привели к усилению напряженности.	1				4a711a21-037c-496b-a53c-9064c89cf808	00024bafed--642fdc4bdc4be92e38c38196	19e16d466b467cbd0189343851128806	2023-04-07T09:03:07.587	2023-04-07T09:03:28.036
33. По случаю Международного дня труда Центр принял участие в первой конференции в <mark>Катаре</mark>, посвященной защите трудовых прав.	1				f592a88b-f68c-4fc0-81bd-5f86778243b0	00024bafed--642fdc4bdc4be92e38c38196	19e16d466b467cbd0189343851128806	2023-04-07T09:03:07.587	2023-04-07T09:03:28.036
:: проверка результативности работы и бюджетирование служебной деятельности, Всемирный банк, Министерство финансов Российской федерации, <mark>Москва</mark>, март 2011 года.	1				27ca1e44-f345-4ad8-abc9-987f522effb3	00024bafed--642fdc62def02f6cb2667ad1	19e16d466b467cbd0189343851128806	2023-04-07T09:03:30.552	2023-04-07T09:04:10.148
"47. Общий индекс потребительских цен (ИПЦ) использовался для расчета порогового <mark>значения</mark> (в терминах валового дохода предприятий в постоянных ценах), согласно которому в данном исследовании выделялись ""малые"" предприятия."	1				6b85a140-60c0-47dc-a81d-f41e6297edde	00024bafed--642fdc62def02f6cb2667ad1	19e16d466b467cbd0189343851128806	2023-04-07T09:03:30.552	2023-04-07T09:04:10.148
Вместе с тем все подтвержденные <mark>доказательствами</mark> жалобы на превышение силами обороны и органами безопасности своих полномочий могут быть переданы для расследования в компетентные судебные инстанции.	1				e778105c-25d4-42e8-b0be-ee2fb704f245	00024bafed--642fdc62def02f6cb2667ad1	19e16d466b467cbd0189343851128806	2023-04-07T09:03:30.552	2023-04-07T09:04:10.148
Продукция, содержащая КЦХП, включая краски, адгезивы, герметики, <mark>резину</mark> и пластмассы, могли быть импортированы в Канаду; считается, что объем такого импорта был небольшим (UNEP/FAO/RC/CRC.10/6, приложение II, п. 2.3.1).	1				44f8dc2a-9d76-4aec-bc1d-ebf403591c40	00024bafed--642fdc62def02f6cb2667ad1	19e16d466b467cbd0189343851128806	2023-04-07T09:03:30.552	2023-04-07T09:04:10.148
Диффамация в <mark>печати</mark> регулируется Законом о подрывных и нежелательных публикациях (1968 года) и наказуема штрафом и тюремным заключением сроком до шести месяцев.	1				a846ee03-88cd-4b01-8be0-98dab297e0ee	00024bafed--642fdc62def02f6cb2667ad1	19e16d466b467cbd0189343851128806	2023-04-07T09:03:30.552	2023-04-07T09:04:10.148
3.4.3.3 Оборудование устанавливают в соответствии со <mark>схемой</mark>, приведенной на рис. A5/7, и проверяют на утечку газа.	1				fdca3ea2-5a9c-4560-9b91-87bdaaa32950	00024bafed--642fdc62def02f6cb2667ad1	19e16d466b467cbd0189343851128806	2023-04-07T09:03:30.552	2023-04-07T09:04:10.148
Благодаря современным научным исследованиям и этическим нормам человечество во все большей степени осознает многочисленные преимущества установления уважительных отношений с миром <mark>природы</mark>.	1				95a51504-ee01-4f3f-9f73-1ece5ae886e1	00024bafed--642fdc62def02f6cb2667ad1	19e16d466b467cbd0189343851128806	2023-04-07T09:03:30.552	2023-04-07T09:04:10.148
Они принимают участие в проекте обсуждения преобразований с учетом гендерных аспектов и работают в тесном контакте с местными <mark>лидерами</mark>, женскими НПО, членами парламента и другими государственными структурами.	1				1b4104d0-f588-4ca2-a8a9-b2452e688c04	00024bafed--642fdc62def02f6cb2667ad1	19e16d466b467cbd0189343851128806	2023-04-07T09:03:30.552	2023-04-07T09:04:10.148
Комитет считает, что в настоящем сообщении авторы не продемонстрировали того, что выводы суда по их делу достигли порога произвольности в оценке <mark>доказательств</mark> или были равнозначными отказу в правосудии.	1				dd21e753-1d86-4188-8328-2939f5a19997	00024bafed--642fdc62def02f6cb2667ad1	19e16d466b467cbd0189343851128806	2023-04-07T09:03:30.552	2023-04-07T09:04:10.148
Этот <<финансовый <mark>обрыв</mark>>>, возникший в результате завершения деятельности миссии и отъезда ее персонала, был также отнесен к числу проблем, которые приходится решать странам в переходный период.	2				41684c64-0f46-4ef2-9347-6f9ddd66902f	00024bafed--642fdc62def02f6cb2667ad1	19e16d466b467cbd0189343851128806	2023-04-07T09:03:30.552	2023-04-07T09:04:10.148
По сути, с момента его избрания лидером киприотов-<mark>греков</mark> в феврале 2013 года он проявлял пассивность на переговорах.	1				a41f5db0-e11b-4671-9cf6-611d18b5f0ce	00024bafed--642fdc70e6d3ce2801c95903	2954518e5a59c1a05124ea928dd47a22	2023-04-07T09:03:44.889	2023-04-07T09:05:48.606
За несколько дней до этого происшествия толпа прихожан <<Киевского патриархата>> заблокировала архиепископа Евлогия в кафедральном <mark>соборе</mark> и кричала: <<Геть московского попа>> и <<Евлогия -- на виселицу>>.	1				4c4a9c57-15bc-4849-a261-ca9614a7e766	00024bafed--642fdc70e6d3ce2801c95903	2954518e5a59c1a05124ea928dd47a22	2023-04-07T09:03:44.889	2023-04-07T09:05:48.606
Она высоко оценила усилия по защите прав лиц с ограниченными возможностями во многих областях, в том <mark>числе</mark> в сфере занятости, образования, здравоохранения и других государственных услуг.	1				f8a057f2-0ecb-4601-9574-209ed32d9933	00024bafed--642fdc70e6d3ce2801c95903	2954518e5a59c1a05124ea928dd47a22	2023-04-07T09:03:44.889	2023-04-07T09:05:48.606
Координацию выполнения этих функций лучше всего поручить офицеру, который пользуется среди военных <mark>авторитетом</mark> и имеет соответствующий статус.	1				ae1e8655-1f29-419e-98ec-e498aa007bb2	00024bafed--642fdc70e6d3ce2801c95903	2954518e5a59c1a05124ea928dd47a22	2023-04-07T09:03:44.889	2023-04-07T09:05:48.606
В других случаях третьи стороны в рамках своих услуг предлагают торговым партнерам различные варианты решений с полностью автоматической <mark>настройкой</mark>, услуги по компиляции и передаче данных, повышению безопасности, архивации/	1				65dad43f-4702-4ad9-a377-b32bc2e28aae	00024bafed--642fdc70e6d3ce2801c95903	2954518e5a59c1a05124ea928dd47a22	2023-04-07T09:03:44.889	2023-04-07T09:05:48.606
Спинно-поясничный отруб отделяют разрубом в точке сочленения поясничного и крестцового <mark>позвонков</mark> краниально к тазобедренным буграм до брюшного участка пашины.	1				13ecf1bc-0c35-4192-9d68-2da0cccea2fa	00024bafed--642fdc70e6d3ce2801c95903	2954518e5a59c1a05124ea928dd47a22	2023-04-07T09:03:44.889	2023-04-07T09:05:48.606
В результате включения в состав Российской <mark>империи</mark> в Армении стали ускоряться процессы возрождения национального самосознания и развития капиталистических отношений.	1				4efdad8f-5b19-46d6-aeaa-63437b45157a	00024bafed--642fdc70e6d3ce2801c95903	2954518e5a59c1a05124ea928dd47a22	2023-04-07T09:03:44.889	2023-04-07T09:05:48.606
Например, проведение официальных <mark>праздников</mark> в организациях и учреждениях, как правило, происходит согласно преобладающим в стране религиозным и культурным традициям.	1				0ec4d956-0860-4d4c-917a-e67a291d2540	00024bafed--642fdc70e6d3ce2801c95903	2954518e5a59c1a05124ea928dd47a22	2023-04-07T09:03:44.889	2023-04-07T09:05:48.606
d) токсинов, что открывает новые перспективы для медицины и исследований в таких областях, как способы лечения нервно-мышечных расстройств и постэкспозиционное <mark>лечение</mark>, а также обнаружение и диагностика токсинов.	1				bf474866-fe61-4abc-8912-9f9e4b64ef62	00024bafed--642fdc70e6d3ce2801c95903	2954518e5a59c1a05124ea928dd47a22	2023-04-07T09:03:44.889	2023-04-07T09:05:48.606
Наша организация участвует в мероприятиях, направленных на поощрение гендерного равенства и расширение прав и возможностей женщин как важнейшего условия для улучшения <mark>качества</mark> жизни всех членов семьи.	1				0a7eadbe-af8b-4844-943d-cad368e8f7a6	00024bafed--642fdc70e6d3ce2801c95903	2954518e5a59c1a05124ea928dd47a22	2023-04-07T09:03:44.889	2023-04-07T09:05:48.606
"Программа по <mark>информатизации</mark> Африки подписала соглашение с провайдером услуг спутниковой и оптико-волоконной связи (First Space Fiber) о разработке модельных рамок для ""электронных школ"", испытания которых пройдут в Сенегале."	1				c2e967cc-29c1-44ad-8b88-319ae5fd032a	00024bafed--642fdc970dc3092cc77f4f26	19e16d466b467cbd0189343851128806	2023-04-07T09:04:23.112	2023-04-07T09:04:43.204
Улучшились показатели соблюдения процедур антиретровирусной <mark>терапии</mark> и терапевтического лечения туберкулеза, указывая на то, что питание в медицинских учреждениях позволило пациентам регулярно их посещать.	2				23cb1979-d0fa-4276-a281-c1304e8d739c	00024bafed--642fdc970dc3092cc77f4f26	19e16d466b467cbd0189343851128806	2023-04-07T09:04:23.112	2023-04-07T09:04:43.204
250. В области международных культурных обменов, конкурсов и фестивалей <mark>Дирекция</mark> занимается организацией фестивалей арабской музыки.	2				0593b6b6-c3ef-4e2c-b994-a181120c2820	00024bafed--642fdc970dc3092cc77f4f26	19e16d466b467cbd0189343851128806	2023-04-07T09:04:23.112	2023-04-07T09:04:43.204
За неимением универсального решения, при разработке макропруденциальных стратегий и мер прямого контроля за <mark>движением</mark> капитала необходимо принимать во внимание специфику положения стран.	1				c088a24b-dced-4dcc-9d7f-730d28e80a8a	00024bafed--642fdc970dc3092cc77f4f26	19e16d466b467cbd0189343851128806	2023-04-07T09:04:23.112	2023-04-07T09:04:43.204
Недавнее осквернение мечети аль-Акса является частью систематической кампании Израиля, нацеленной на изменение правового статуса Восточного <mark>Иерусалима</mark>.	1				83bc4492-7160-492d-92d6-b440170ac01a	00024bafed--642fdc970dc3092cc77f4f26	19e16d466b467cbd0189343851128806	2023-04-07T09:04:23.112	2023-04-07T09:04:43.204
Нарушителями стали ПФСИ (6 случаев), ЛРА (5), ДСОР/Боевые силы Абакунгузи (3), <<Райя мутомбоки>> (3), АПССК (2), Союз конголезских <mark>патриотов</mark> за мир (1) и <<майи-майи>> (Якутумба) (1).	1				fd673282-539f-49f2-9c94-78034bcc2b9a	00024bafed--642fdc970dc3092cc77f4f26	19e16d466b467cbd0189343851128806	2023-04-07T09:04:23.112	2023-04-07T09:04:43.204
b) прекратить применение приводимых в действие жертвами СВУ и отказаться от неизбирательного использования СВУ, особенно в местах <mark>скопления</mark> гражданского населения;	1				23ceb02b-4952-4fec-84a4-c6034f6f467b	00024bafed--642fdc970dc3092cc77f4f26	19e16d466b467cbd0189343851128806	2023-04-07T09:04:23.112	2023-04-07T09:04:43.204
принимая во внимание анализ и рекомендации Группы, которые касаются исключений в отношении основных видов применения регулируемых веществ для изготовления дозированных ингаляторов, используемых при лечении <mark>астмы</mark> и хронической обструктивной болезни легких,	1				8591d967-c198-4fe2-a2b3-55f8abb7b27e	00024bafed--642fdc970dc3092cc77f4f26	19e16d466b467cbd0189343851128806	2023-04-07T09:04:23.112	2023-04-07T09:04:43.204
Секретариат будет регулярно представлять Совету доклады о достигнутом прогрессе вместе с <mark>рекомендациями</mark> относительно любых корректировок графика уничтожения, при необходимости.	1				495cc4aa-5f3b-4a3d-8c06-a41a82b486f6	00024bafed--642fdc970dc3092cc77f4f26	19e16d466b467cbd0189343851128806	2023-04-07T09:04:23.112	2023-04-07T09:04:43.204
Расстояние между внутренними краями задних светоотражающих приспособлений должно быть не менее 300 мм, а вертикальный <mark>угол</mark> видимости между ними должен составлять 15° над горизонталью.	1				7fbd96f6-422e-4ed2-ad11-20d788e35e52	00024bafed--642fdc970dc3092cc77f4f26	19e16d466b467cbd0189343851128806	2023-04-07T09:04:23.112	2023-04-07T09:04:43.204
"""2.16 ""Стандартная эталонная испытательная шина"" (СЭИШ) означает шину, которая изготавливается, проверяется и хранится в соответствии со стандартами Американского общества по испытаниям и материалам (<mark>АСТМ</mark>),"	5				ff137835-0983-4c45-a13b-2352662f55c4	00024bafed--642fdcad2d027f1176f99ba9	19e16d466b467cbd0189343851128806	2023-04-07T09:04:45.619	2023-04-07T09:05:08.044
Оно также нарушает положения статей 12 и 13 Пакта, которые гарантируют свободу передвижения и право на обжалование решения о его высылке с территории страны в компетентном <mark>органе</mark> власти.	1				221902e0-f3a1-449c-947d-9a1056d3e018	00024bafed--642fdcad2d027f1176f99ba9	19e16d466b467cbd0189343851128806	2023-04-07T09:04:45.619	2023-04-07T09:05:08.044
51. В настоящей записке описана концепция инклюзивной инновационной деятельности и рассмотрен ряд связей и <mark>аспектов</mark>, которые необходимо учитывать, для того чтобы инновационные системы были более благоприятными для инклюзивных инноваций.	2				bcc42bef-2366-40d8-b7b4-f4209c5f4550	00024bafed--642fdcad2d027f1176f99ba9	19e16d466b467cbd0189343851128806	2023-04-07T09:04:45.619	2023-04-07T09:05:08.044
40. Решение Азербайджана выступить по пункту повестки дня, касающемуся права на самоопределение, носит провокационный характер, учитывая то, что Азербайджан отказывает народу Нагорного <mark>Карабаха</mark> именно в этом праве.	2				eb241d16-aba6-4195-9a28-764e1a7c15a4	00024bafed--642fdcad2d027f1176f99ba9	19e16d466b467cbd0189343851128806	2023-04-07T09:04:45.619	2023-04-07T09:05:08.044
В случае отсутствия <mark>редактора</mark> ответственность за разработку проекта и регистрацию комментариев и ответов на замечания несет руководитель проекта.	1				a312823e-2e51-4973-b2c6-74c5c0adc971	00024bafed--642fdcad2d027f1176f99ba9	19e16d466b467cbd0189343851128806	2023-04-07T09:04:45.619	2023-04-07T09:05:08.044
В этой связи в деле искоренения нищеты, обес-<mark>печения</mark> экономического роста и устойчивого развития решающую роль играют женщины, особенно женщины-предприниматели.	1				28cb4a72-b671-401b-ad0b-b340738adc44	00024bafed--642fdcad2d027f1176f99ba9	19e16d466b467cbd0189343851128806	2023-04-07T09:04:45.619	2023-04-07T09:05:08.044
Матрос парома без <mark>винта</mark>: базовое образование, минимальный опыт работы − полгода практики на соответствующем водном пути.	1				b45c7123-51fb-4bfa-b9a6-984ac070ac5c	00024bafed--642fdcad2d027f1176f99ba9	19e16d466b467cbd0189343851128806	2023-04-07T09:04:45.619	2023-04-07T09:05:08.044
6. Д-р Эссам аль-Хаддад (далее д-р Аль-Хаддад), 60 лет, родился в <mark>Александрии</mark>, советник по международным вопросам д-ра Мурси.	1				899cde49-218e-47e4-bc8c-7489c017b66f	00024bafed--642fdcad2d027f1176f99ba9	19e16d466b467cbd0189343851128806	2023-04-07T09:04:45.619	2023-04-07T09:05:08.044
В 2013 году началась работа по использованию экономических инструментов для управления водными ресурсами на региональном уровне в Республике <mark>Бурятия</mark>.	1				163d4630-3dd8-46c9-ad29-d4b6446b342c	00024bafed--642fdcad2d027f1176f99ba9	19e16d466b467cbd0189343851128806	2023-04-07T09:04:45.619	2023-04-07T09:05:08.044
"3.1.2 ""Калибровка"" означает процесс <mark>настройки</mark> чувствительности системы измерения таким образом, чтобы ее показания соответствовали диапазону эталонных сигналов."	1				65de0bf2-55c0-42bb-9898-98b7314fed92	00024bafed--642fdcad2d027f1176f99ba9	19e16d466b467cbd0189343851128806	2023-04-07T09:04:45.619	2023-04-07T09:05:08.044
Члены Совета согласовали элементы заявления для <mark>печати</mark>, которые были зачитаны представителям средств массовой информации Председателем Совета по завершении консультаций.	1				efaf12e9-c09f-4655-99a4-8c4d3a4b1a95	00024bafed--642fdcc6e7366f05ae3d9289	19e16d466b467cbd0189343851128806	2023-04-07T09:05:10.825	2023-04-07T09:05:38.120
