INPUT:text	OUTPUT:complexity	GOLDEN:complexity	HINT:text	HINT:default_language	ASSIGNMENT:task_id	ASSIGNMENT:assignment_id	ASSIGNMENT:worker_id	ASSIGNMENT:started	ASSIGNMENT:submitted
Подкомитет также принял к сведению информацию о сотрудничестве правительств Канады, Российской Федерации, Соединенных Штатов и <mark>Франции</mark> в рамках Международной спутниковой системы поиска и спасания (КОСПАССАРСАТ).	3				5ca7d9c8-300b-4ab7-97d2-89ab0802aeea	00024bb00b--642fdf7d175e6a13b6b10f5b	0c76bd8d32a208bcc65e0c0afeb5c483	2023-04-07T09:16:45.535	2023-04-07T09:17:15.197
Проект под названием <<<mark>Сумка</mark> мечты>> предусматривает распределение среди детей, находящихся в районах, затронутых конфликтами, сумок, наполненных канцелярскими товарами, игрушками и дружескими посланиями.	2				bccc4567-5ed4-4324-bf1d-c0e2977af3dc	00024bb00b--642fdf7d175e6a13b6b10f5b	0c76bd8d32a208bcc65e0c0afeb5c483	2023-04-07T09:16:45.535	2023-04-07T09:17:15.197
Ашраф эль-Хагог был в первую очередь обвинен в действиях, направленных против безопасности государства, что является одной из форм <mark>предательства</mark>.	3				74e16b85-bbdb-4635-b97d-ac1b000e299b	00024bb00b--642fdf7d175e6a13b6b10f5b	0c76bd8d32a208bcc65e0c0afeb5c483	2023-04-07T09:16:45.535	2023-04-07T09:17:15.197
Тела <mark>позвонков</mark> (хребтового края) на подготовленных ребрах удаляются с обнажением постного мяса, но остистые отростки (перовидные кости) не отделяются.	3				ba5a522c-7bfc-4ba0-ac58-96cd7dc95fbb	00024bb00b--642fdf7d175e6a13b6b10f5b	0c76bd8d32a208bcc65e0c0afeb5c483	2023-04-07T09:16:45.535	2023-04-07T09:17:15.197
Согласно докладу о глобальном гендерном неравенстве (Global Gender Gap Report), который публикуется Всемирным экономическим форумом, Новая Зеландия входит в <mark>десятку</mark> стран, добившихся наибольших успехов в деле улучшения положения женщин.	1				bdcb1ff3-0ebe-45a1-a2fe-e47806898087	00024bb00b--642fdf7e2d29fb66b56154b1	1b34f9eb4fa0f59d792564ff79aad3b6	2023-04-07T09:16:46.233	2023-04-07T09:17:12.383
В состав рабочей группы должны входить представители правительства (высшие должностные лица) и торговых кругов (<mark>менеджеры</mark> корпораций/компаний, специалисты по логистике...), обладающие признанной репутацией в сфере международного бизнеса.	4				df5d2b89-81ea-46ba-8ac4-aeafa12d3bad	00024bb00b--642fdf7e2d29fb66b56154b1	1b34f9eb4fa0f59d792564ff79aad3b6	2023-04-07T09:16:46.233	2023-04-07T09:17:12.383
Уважаемые матери и <mark>сестры</mark>, НПО <<Ассоциация содействия иностранцам в Того>> представляет вам информацию по следующим вопросам:	2				662c4156-fa62-4d56-bdd8-144b4cfb7150	00024bb00b--642fdf7e2d29fb66b56154b1	1b34f9eb4fa0f59d792564ff79aad3b6	2023-04-07T09:16:46.233	2023-04-07T09:17:12.383
Продолжающееся насилие является не просто погрешением против плана <mark>Господа</mark> собрать под крылом единства всех своих разобщенных чад.	2				a09776ea-5874-4121-83e3-3b37bcb4824b	00024bb00b--642fdf7e2d29fb66b56154b1	1b34f9eb4fa0f59d792564ff79aad3b6	2023-04-07T09:16:46.233	2023-04-07T09:17:12.383
5.2 Определение давления в <mark>шинах</mark> при его снижении по причине какого-либо происшествия (испытание на пробой)	1				f58da189-4159-489f-8dc4-5a41034689ac	00024bb00b--642fdf7e2d29fb66b56154b1	1b34f9eb4fa0f59d792564ff79aad3b6	2023-04-07T09:16:46.233	2023-04-07T09:17:12.383
По данным Центральной избирательной комиссии в следующем году на парламентских выборах в Кыргызстане находящиеся в Российской Федерации мигранты смогут проголосовать только в четырех городах России: Москве, Санкт-Петербурге, <mark>Новосибирске</mark> и Екатеринбурге.	1				b9d6cd9e-7ff4-4e81-bdf0-d174f4465386	00024bb00b--642fdf7e2d29fb66b56154b1	1b34f9eb4fa0f59d792564ff79aad3b6	2023-04-07T09:16:46.233	2023-04-07T09:17:12.383
Сотрудники органов безопасности снова отказались предоставить автору более точные сведения об обстоятельствах смерти его сына и даже сообщить место его <mark>захоронения</mark>.	1				eb396bcc-c1bd-45a4-9693-9f3796d07354	00024bb00b--642fdf7e2d29fb66b56154b1	1b34f9eb4fa0f59d792564ff79aad3b6	2023-04-07T09:16:46.233	2023-04-07T09:17:12.383
b) После полной зарядки испытуемого аккумулятора в соответствии с <mark>методом</mark> зарядки, указанным изготовителем, его выдерживают в течение не менее 1 часа, но не более 4 часов.	2				aebef267-3304-4a07-80f3-f23d0ac0d13e	00024bb00b--642fdf7e2d29fb66b56154b1	1b34f9eb4fa0f59d792564ff79aad3b6	2023-04-07T09:16:46.233	2023-04-07T09:17:12.383
Мотивировка старших руководителей, способная обеспечить принятие ими принципов управления, ориентированного на результаты, зависит от того, признают ли они <mark>ценность</mark> расходования времени и ресурсов на приобретение и использование информации о результатах.	3				08d05695-742b-47f7-af7e-f7d4a7b7d989	00024bb00b--642fdf7e2d29fb66b56154b1	1b34f9eb4fa0f59d792564ff79aad3b6	2023-04-07T09:16:46.233	2023-04-07T09:17:12.383
Расследованием случаев экономического <mark>мошенничества</mark> и преступлений с использованием личных данных и принятием мер по их предупреждению занимается также Управление по финансовым исследованиям и борьбе с отмыванием денег.	1				2a235463-9c20-4752-837d-c724b0c586b4	00024bb00b--642fdf7e2d29fb66b56154b1	1b34f9eb4fa0f59d792564ff79aad3b6	2023-04-07T09:16:46.233	2023-04-07T09:17:12.383
Они должны направляться в кратчайшие возможные сроки на имя <mark>начальника</mark> Группы контроля за документацией (srcorrections@un.org).	1				383a2cc4-9620-4815-ad92-3938dcdfa185	00024bb00b--642fdf7ede55d10de865b18d	77e348d04945cb44a3454d3ec9e40cb5	2023-04-07T09:16:46.700	2023-04-07T09:17:33.527
:: Реализация к 2016 году национального плана мероприятий по обеспечению готовности к стихийным бедствиям и создание в его поддержку комиссии с четко определенными <mark>задачами</mark>	1				653feeda-47e1-40a2-bcfd-eae4e11423de	00024bb00b--642fdf7ede55d10de865b18d	77e348d04945cb44a3454d3ec9e40cb5	2023-04-07T09:16:46.700	2023-04-07T09:17:33.527
Некоторые представители отметили, что активное гражданское общество имеет существенное значение для конструктивного общения между представителями различных <mark>культур</mark>, религий и цивилизаций.	2				c09f1df8-b741-4a24-99a7-1473ecd86a1a	00024bb00b--642fdf7ede55d10de865b18d	77e348d04945cb44a3454d3ec9e40cb5	2023-04-07T09:16:46.700	2023-04-07T09:17:33.527
В первом подсекторе, расположенном в Муленге, территория Увира, командует «полковник» <mark>Фред</mark> Иракиза, а во втором подсекторе, находящемся в Мугуту, территория Мвенга, руководит «полковник» Муньянеза Джоб.	3				c7daa659-750b-46ce-ae39-77b638332096	00024bb00b--642fdf7ede55d10de865b18d	77e348d04945cb44a3454d3ec9e40cb5	2023-04-07T09:16:46.700	2023-04-07T09:17:33.527
d) методика устойчивого управления земельными ресурсами (УУЗР) способна обеспечить позитивный синергизм между изменением климата и деградацией земель на основе изменений в накоплениях углерода в почве и <mark>растительности</mark>.	1				27a62e9c-9d84-49fd-b702-5c0814131f7a	00024bb00b--642fdf7ede55d10de865b18d	77e348d04945cb44a3454d3ec9e40cb5	2023-04-07T09:16:46.700	2023-04-07T09:17:33.527
Согласно этой статье притеснения и сексуальные домогательства равносильны дискриминации по <mark>смыслу</mark> статьи 6 того же закона.	1				6817af91-9077-4add-a1da-24fee6b5473b	00024bb00b--642fdf7ede55d10de865b18d	77e348d04945cb44a3454d3ec9e40cb5	2023-04-07T09:16:46.700	2023-04-07T09:17:33.527
Проект, осуществляемый в партнерстве с женскими организациями, театральными <mark>труппами</mark> и местными органами власти, предусматривает постановки представлений и создание произведений искусства в качестве стимула к конкретным действиям для достижения значимых изменений.	1				d13a2d2f-7d6d-4cac-8f51-05acba029c54	00024bb00b--642fdf7ede55d10de865b18d	77e348d04945cb44a3454d3ec9e40cb5	2023-04-07T09:16:46.700	2023-04-07T09:17:33.527
В качестве конкретного <mark>примера</mark> она рассмотрела также меры, принимаемые администрацией к расширению функциональных возможностей персонала материально-технического обеспечения.	2				0f0debfa-f761-4435-a439-fdaca917789f	00024bb00b--642fdf7ede55d10de865b18d	77e348d04945cb44a3454d3ec9e40cb5	2023-04-07T09:16:46.700	2023-04-07T09:17:33.527
Анализ ухудшения состояния окружающей среды крайне важен для восстановления объектов и <mark>сооружений</mark> Организации Объединенных Наций во всех районах операций.	2				350c73ef-ef05-4af5-8b25-3cb2ca0e283a	00024bb00b--642fdf7ede55d10de865b18d	77e348d04945cb44a3454d3ec9e40cb5	2023-04-07T09:16:46.700	2023-04-07T09:17:33.527
Третий знак указывает на то, относится ли данный вопрос к основным знаниям, знаниям по физике и <mark>химии</mark>, практическим знаниям или мерам, принимаемым в чрезвычайной ситуации.	1				4f5fa39a-3105-4ce5-b6ce-b93e1d0a821d	00024bb00b--642fdf7ede55d10de865b18d	77e348d04945cb44a3454d3ec9e40cb5	2023-04-07T09:16:46.700	2023-04-07T09:17:33.527
"* <mark>Фары</mark> с модулем СИД класса А, предусмотренным Правилами № 113, только на транспортных средствах, максимальная расчетная скорость которых не превышает 25 км/ч""."	1				dc9d1cdd-cf8f-4a98-aff4-18e15773fe01	00024bb00b--642fdf7f2d027f1176f9fecb	803b9a0e24a168d91e959a5beb69f9e5	2023-04-07T09:16:47.445	2023-04-07T09:17:26.008
Также имеется риск для <mark>птиц</mark> и млекопитающих, обусловленный потреблением мертвых насекомых, а также - возможно - другими путями воздействия.	1				121bd1f7-1082-4dbb-aa22-ec3e3eaa692c	00024bb00b--642fdf7f2d027f1176f9fecb	803b9a0e24a168d91e959a5beb69f9e5	2023-04-07T09:16:47.445	2023-04-07T09:17:26.008
Я хочу поблагодарить тех военнослужащих Украины, которые не пошли на кровопролитие и не запятнали себя <mark>кровью</mark>.	1				d97d2203-4cc6-47d1-9a07-03d4f8c4a351	00024bb00b--642fdf7f2d027f1176f9fecb	803b9a0e24a168d91e959a5beb69f9e5	2023-04-07T09:16:47.445	2023-04-07T09:17:26.008
Медоносная <mark>пчела</mark>, ЛД50 при контакте (48-часовое исследование острой токсичности): 0,16 нг/пчела (FAO 2004); 0,31 мкг/пчела (EU 2002)	1				31d2fdf6-b163-433c-9d1a-4ad0a256c922	00024bb00b--642fdf7f2d027f1176f9fecb	803b9a0e24a168d91e959a5beb69f9e5	2023-04-07T09:16:47.445	2023-04-07T09:17:26.008
9. Неизбежные отклонения от рекомендуемых определений и классификаций, обусловленные особенностями национальной образовательной системы, должны поясняться в <mark>материалах</mark> переписи и/или соответствующих метаданных.	1				752b3449-418f-4a06-9949-b6672c267c5a	00024bb00b--642fdf7f2d027f1176f9fecb	803b9a0e24a168d91e959a5beb69f9e5	2023-04-07T09:16:47.445	2023-04-07T09:17:26.008
Терроризм не должен ассоциироваться ни с какими религией, расой, верой, <mark>теологией</mark>, ценностями, культурой, обществом или группой, и никакая религия или религиозная доктрина не должна изображаться как поощряющая или пропагандирующая терроризм.	1				a1111d7b-abb6-4042-aa01-755ab370a7bf	00024bb00b--642fdf7f2d027f1176f9fecb	803b9a0e24a168d91e959a5beb69f9e5	2023-04-07T09:16:47.445	2023-04-07T09:17:26.008
8. Основным средством для отказа в гражданских правах до сих пор является разрешительный порядок, крайне стесняющий их <mark>реализацию</mark>.	1				9c9dd331-80ce-4598-bf83-7acad539a362	00024bb00b--642fdf7f2d027f1176f9fecb	803b9a0e24a168d91e959a5beb69f9e5	2023-04-07T09:16:47.445	2023-04-07T09:17:26.008
Расчет массы выбросов за цикл методом <mark>интегрирования</mark> мгновенных значений выбросов и значений u, взятых из таблицы 5 (пункт 8.4.2.3)	4				49424b26-d097-4ff8-84ea-4107bd187f1c	00024bb00b--642fdf7f2d027f1176f9fecb	803b9a0e24a168d91e959a5beb69f9e5	2023-04-07T09:16:47.445	2023-04-07T09:17:26.008
31. Руководство МООНСДРК и члены дипломатического корпуса указали на необходимость устранения <mark>различий</mark> между бригадой оперативного вмешательства и <<рамочными>> бригадами.	1				d4ea3177-bcb6-4e69-8338-646229fbc5da	00024bb00b--642fdf7f2d027f1176f9fecb	803b9a0e24a168d91e959a5beb69f9e5	2023-04-07T09:16:47.445	2023-04-07T09:17:26.008
Суд заключил, что невоенная, альтернативная, гражданская трудовая служба является компромиссом между конституционным правом на свободу вероисповедания и конституционным долгом по защите <mark>отечества</mark>.	1				d3e92298-b1b7-49d0-bba1-202845077d51	00024bb00b--642fdf7f2d027f1176f9fecb	803b9a0e24a168d91e959a5beb69f9e5	2023-04-07T09:16:47.445	2023-04-07T09:17:26.008
Они должны направляться в кратчайшие возможные сроки на имя <mark>начальника</mark> Группы контроля за документацией (srcorrections@un.org).	1				383a2cc4-9620-4815-ad92-3938dcdfa185	00024bb00b--642fdf7f64aa503006bc3f95	c0278bdfdbb88139e7813d886d2db32f	2023-04-07T09:16:47.372	2023-04-07T09:18:02.156
:: Реализация к 2016 году национального плана мероприятий по обеспечению готовности к стихийным бедствиям и создание в его поддержку комиссии с четко определенными <mark>задачами</mark>	1				653feeda-47e1-40a2-bcfd-eae4e11423de	00024bb00b--642fdf7f64aa503006bc3f95	c0278bdfdbb88139e7813d886d2db32f	2023-04-07T09:16:47.372	2023-04-07T09:18:02.156
Некоторые представители отметили, что активное гражданское общество имеет существенное значение для конструктивного общения между представителями различных <mark>культур</mark>, религий и цивилизаций.	2				c09f1df8-b741-4a24-99a7-1473ecd86a1a	00024bb00b--642fdf7f64aa503006bc3f95	c0278bdfdbb88139e7813d886d2db32f	2023-04-07T09:16:47.372	2023-04-07T09:18:02.156
В первом подсекторе, расположенном в Муленге, территория Увира, командует «полковник» <mark>Фред</mark> Иракиза, а во втором подсекторе, находящемся в Мугуту, территория Мвенга, руководит «полковник» Муньянеза Джоб.	2				c7daa659-750b-46ce-ae39-77b638332096	00024bb00b--642fdf7f64aa503006bc3f95	c0278bdfdbb88139e7813d886d2db32f	2023-04-07T09:16:47.372	2023-04-07T09:18:02.156
d) методика устойчивого управления земельными ресурсами (УУЗР) способна обеспечить позитивный синергизм между изменением климата и деградацией земель на основе изменений в накоплениях углерода в почве и <mark>растительности</mark>.	2				27a62e9c-9d84-49fd-b702-5c0814131f7a	00024bb00b--642fdf7f64aa503006bc3f95	c0278bdfdbb88139e7813d886d2db32f	2023-04-07T09:16:47.372	2023-04-07T09:18:02.156
Согласно этой статье притеснения и сексуальные домогательства равносильны дискриминации по <mark>смыслу</mark> статьи 6 того же закона.	1				6817af91-9077-4add-a1da-24fee6b5473b	00024bb00b--642fdf7f64aa503006bc3f95	c0278bdfdbb88139e7813d886d2db32f	2023-04-07T09:16:47.372	2023-04-07T09:18:02.156
Проект, осуществляемый в партнерстве с женскими организациями, театральными <mark>труппами</mark> и местными органами власти, предусматривает постановки представлений и создание произведений искусства в качестве стимула к конкретным действиям для достижения значимых изменений.	2				d13a2d2f-7d6d-4cac-8f51-05acba029c54	00024bb00b--642fdf7f64aa503006bc3f95	c0278bdfdbb88139e7813d886d2db32f	2023-04-07T09:16:47.372	2023-04-07T09:18:02.156
В качестве конкретного <mark>примера</mark> она рассмотрела также меры, принимаемые администрацией к расширению функциональных возможностей персонала материально-технического обеспечения.	1				0f0debfa-f761-4435-a439-fdaca917789f	00024bb00b--642fdf7f64aa503006bc3f95	c0278bdfdbb88139e7813d886d2db32f	2023-04-07T09:16:47.372	2023-04-07T09:18:02.156
Анализ ухудшения состояния окружающей среды крайне важен для восстановления объектов и <mark>сооружений</mark> Организации Объединенных Наций во всех районах операций.	2				350c73ef-ef05-4af5-8b25-3cb2ca0e283a	00024bb00b--642fdf7f64aa503006bc3f95	c0278bdfdbb88139e7813d886d2db32f	2023-04-07T09:16:47.372	2023-04-07T09:18:02.156
Третий знак указывает на то, относится ли данный вопрос к основным знаниям, знаниям по физике и <mark>химии</mark>, практическим знаниям или мерам, принимаемым в чрезвычайной ситуации.	2				4f5fa39a-3105-4ce5-b6ce-b93e1d0a821d	00024bb00b--642fdf7f64aa503006bc3f95	c0278bdfdbb88139e7813d886d2db32f	2023-04-07T09:16:47.372	2023-04-07T09:18:02.156
В. Какие стратегии необходимы на национальном уровне для создания в городах более благоприятных условий для <mark>ходьбы</mark> пешком и езды на велосипеде?	2				dcd8be50-00d3-4c23-b9ae-d6f6d17fd922	00024bb00b--642fdf80cfff71646bd73c07	80c2ff30882e01d1d5ee3008bc20052a	2023-04-07T09:16:48.152	2023-04-07T09:19:06.721
b) принятие <mark>постановления</mark> Министерства общественных работ № 14/2010 о минимальных стандартах обслуживания в области общественных работ и планирования землепользования;	4				28311a03-a8e3-424f-9404-3224fb58d9f5	00024bb00b--642fdf80cfff71646bd73c07	80c2ff30882e01d1d5ee3008bc20052a	2023-04-07T09:16:48.152	2023-04-07T09:19:06.721
"3.1.39 ""устройство последующей обработки твердых частиц"" означает систему последующей обработки отработавших <mark>газов</mark>, предназначенную для ограничения выбросов твердых частиц (ТЧ) посредством механической, аэродинамической, диффузионной или инерционной сепарации;"	4				f2d43267-7d26-4ad1-a2f6-1f8dd78ec305	00024bb00b--642fdf80cfff71646bd73c07	80c2ff30882e01d1d5ee3008bc20052a	2023-04-07T09:16:48.152	2023-04-07T09:19:06.721
Он также просил правительство принять меры, устанавливающие соответствующие наказания за эту наихудшую форму детского <mark>труда</mark>.	4				ce205085-bce1-49ff-895b-1433b8f4c83c	00024bb00b--642fdf80cfff71646bd73c07	80c2ff30882e01d1d5ee3008bc20052a	2023-04-07T09:16:48.152	2023-04-07T09:19:06.721
В 100километровом радиусе от Джеры (эпицентр Эболы) был установлен <mark>карантин</mark>, под который попали 40 000 человек.	2				a2c7dd6d-15b6-4411-bc6a-739de0713efb	00024bb00b--642fdf80cfff71646bd73c07	80c2ff30882e01d1d5ee3008bc20052a	2023-04-07T09:16:48.152	2023-04-07T09:19:06.721
18. Кроме того, Центральноафриканская Республика ратифицировала 30 августа 2010 года Конвенцию Международной организации <mark>труда</mark> № 169 о коренных народах и народах, ведущих племенной образ жизни.	4				d28fb3b6-db87-48ff-a50a-d6149b650064	00024bb00b--642fdf80cfff71646bd73c07	80c2ff30882e01d1d5ee3008bc20052a	2023-04-07T09:16:48.152	2023-04-07T09:19:06.721
122. Посольством Республики Узбекистан в Москве и Генконсульством Республики Узбекистан в <mark>Новосибирске</mark> было выявлено 45 фактов торговли людьми с участием граждан Узбекистана.	2				9ec57bf0-d710-42bd-aabb-0859afd64ad5	00024bb00b--642fdf80cfff71646bd73c07	80c2ff30882e01d1d5ee3008bc20052a	2023-04-07T09:16:48.152	2023-04-07T09:19:06.721
