INPUT:text	OUTPUT:complexity	GOLDEN:complexity	HINT:text	HINT:default_language	ASSIGNMENT:task_id	ASSIGNMENT:assignment_id	ASSIGNMENT:worker_id	ASSIGNMENT:started	ASSIGNMENT:submitted
Конфликты, как, например, в Сирийской Арабской Республике или Центральноафриканской Республике, оказывают дополнительное негативное макроэкономическое и микроэкономическое <mark>воздействие</mark> и нарушают социальную структуру общества.	2				3667fefa-d1ce-4098-9c95-656f0aaab127	00024bafed--642fde8c2d027f1176f9ddaa	416098c0e126f51c7e40dda7d089b20a	2023-04-07T09:12:44.861	2023-04-07T09:13:33.284
Запрет на расовую дискриминацию по <mark>смыслу</mark> статьи 1 Конвенции не был в точности инкорпорирован в швейцарское законодательство и, следовательно, не гарантирует защиту, соответствующую международным стандартам.	1				89ddd586-fe69-49d4-8842-95a2e140cf19	00024bafed--642fde8c2d027f1176f9ddaa	416098c0e126f51c7e40dda7d089b20a	2023-04-07T09:12:44.861	2023-04-07T09:13:33.284
Терроризм не должен приравниваться к законной борьбе народов, находящихся под колониальным <mark>господством</mark> или иностранной оккупацией, за самоопределение.	2				c4c19fe3-72ac-4e86-9c6c-42d1dbd551df	00024bafed--642fde8c2d027f1176f9ddaa	416098c0e126f51c7e40dda7d089b20a	2023-04-07T09:12:44.861	2023-04-07T09:13:33.284
Испытание считается успешно пройденным, если в течение первых 10 минут после подачи проверочного давления на резервуаре под давлением не наблюдается заметной остаточной деформации, видимых признаков <mark>деструкции</mark> и видимой утечки.	2				423b0209-15f6-41c8-add8-1a8572a59d8c	00024bafed--642fde8f787b801b1c78ea76	acd235b334da3b42743d3769dcc42975	2023-04-07T09:12:47.449	2023-04-07T09:14:30.184
В этой <mark>связи</mark> Правление рассмотрело первый доклад Комитета по контролю за активами и обязательствами Фонда и одобрило содержащиеся в нем выводы.	2				6f06ca50-3f02-4a81-87f4-4b15bec553fb	00024bafed--642fde8f787b801b1c78ea76	acd235b334da3b42743d3769dcc42975	2023-04-07T09:12:47.449	2023-04-07T09:14:30.184
Организация содействовала достижению цели 3 Целей развития тысячелетия посредством удовлетворения образовательных потребностей молодежи и взрослых в программах, способствующих реализации гражданской позиции и укрепляющих демократические <mark>ценности</mark>.	1				d24e10c5-2f01-4b57-bd82-792fdbbe0100	00024bafed--642fde8f787b801b1c78ea76	acd235b334da3b42743d3769dcc42975	2023-04-07T09:12:47.449	2023-04-07T09:14:30.184
Это наводит на <mark>мысль</mark> о том, что некоторые из их отечественных фирм укрепили конкурентные преимущества и для международного производства.	1				322b9257-2ea8-4ff7-afd3-d02d4b40098a	00024bafed--642fde8f787b801b1c78ea76	acd235b334da3b42743d3769dcc42975	2023-04-07T09:12:47.449	2023-04-07T09:14:30.184
С <mark>заявлением</mark> от имени Группы государств Латинской Америки и Карибского бассейна выступил также представитель Чили.	1				fa5b00e7-d557-4c9c-9665-6e8928bdf545	00024bafed--642fde8f787b801b1c78ea76	acd235b334da3b42743d3769dcc42975	2023-04-07T09:12:47.449	2023-04-07T09:14:30.184
5,8 (оценка на <mark>средину</mark> года) в среднем за 5-летний период с 2008 по 2013 год.	1				2e79b0ce-b540-428d-a24d-6bac2064de62	00024bafed--642fde8f787b801b1c78ea76	acd235b334da3b42743d3769dcc42975	2023-04-07T09:12:47.449	2023-04-07T09:14:30.184
Кроме того, центральные <mark>банки</mark> этих стран в качестве одного из важных инструментов уменьшения вероятности непредвиденных ситуаций и регулирования ожиданий рынка применяют практику упреждающего обозначения ориентиров.	1				8eb5e3f2-3fe4-4ef9-bff0-510213e7bf18	00024bafed--642fde8f787b801b1c78ea76	acd235b334da3b42743d3769dcc42975	2023-04-07T09:12:47.449	2023-04-07T09:14:30.184
5. напоминает бывшей югославской Республике Македония, Норвегии, Республике Молдова, Румынии, Хорватии, Швейцарии и Швеции о <mark>важности</mark> своевременного представления данных с привязкой к сетке;	1				785c0ac5-25e5-481a-9e4f-ee49b4b20d5a	00024bafed--642fde8f787b801b1c78ea76	acd235b334da3b42743d3769dcc42975	2023-04-07T09:12:47.449	2023-04-07T09:14:30.184
С заявлениями выступили представители Алжира, Мексики, Таиланда, <mark>Кубы</mark>, Индонезии, Китая, Республики Корея, Бразилии, Норвегии, Японии и Соединенных Штатов.	1				14a6d0a0-6399-4296-8e10-1072cb1292e6	00024bafed--642fde8f787b801b1c78ea76	acd235b334da3b42743d3769dcc42975	2023-04-07T09:12:47.449	2023-04-07T09:14:30.184
Исходя из этого, США постоянно считали захват и господство над Корейским полуостровом ключевым звеном в составлении политики по реализации своей стратегии глобального <mark>господства</mark>.	2				b520261e-a439-4f3c-a8d5-be75e5e373d5	00024bafed--642fde8f787b801b1c78ea76	acd235b334da3b42743d3769dcc42975	2023-04-07T09:12:47.449	2023-04-07T09:14:30.184
23. Упрощение процедур торговли должно принести выгоды, сходные с выгодами от снижения ставок <mark>тарифа</mark>, поскольку обременительные таможенные процедуры приводят к увеличению торговых издержек.	3				a3fa8c8e-7e13-46ce-90a2-8684bec130de	00024bafed--642fde95bfbe7f7e1c3eea49	8f10d6ebe13bd5b8f57a778ebcaed6f0	2023-04-07T09:12:53.978	2023-04-07T09:13:16.240
В секторе финансовых услуг все страны ВАС взяли на себя обязательства в отношении банковских и страховых услуг, оговорив лишь небольшой набор условий (например, требование постоянного проживания для банковских <mark>менеджеров</mark>).	4				ebfd485d-e430-4e88-8ab3-8127a0c7b4de	00024bafed--642fde95bfbe7f7e1c3eea49	8f10d6ebe13bd5b8f57a778ebcaed6f0	2023-04-07T09:12:53.978	2023-04-07T09:13:16.240
72. КЛРД выразил <mark>беспокойство</mark> в связи с тем, что система выдачи разрешений на работу и квот для найма иностранных работников носит ограничительный характер и может привести к дискриминации.	3				8c05c0b1-ebc7-4ab7-9a1f-8e48c2810ceb	00024bafed--642fde95bfbe7f7e1c3eea49	8f10d6ebe13bd5b8f57a778ebcaed6f0	2023-04-07T09:12:53.978	2023-04-07T09:13:16.240
48. В соответствии с этими директивами МИНСВ, его технические партнеры и организации инвалидов совместными усилиями составили Практический справочник по вопросам доступа инвалидов в общественные инфраструктурные <mark>сооружения</mark>, здания и места.	3				06531139-56ac-4bf5-af1c-210eddd12899	00024bafed--642fde95bfbe7f7e1c3eea49	8f10d6ebe13bd5b8f57a778ebcaed6f0	2023-04-07T09:12:53.978	2023-04-07T09:13:16.240
b) Конвенция против пыток и других жестоких, бесчеловечных или унижающих достоинство видов обращения или <mark>наказания</mark> -- в 2011 году;	2				3fedb5d2-8ceb-4fde-b9fb-9bcd737d0017	00024bafed--642fde95bfbe7f7e1c3eea49	8f10d6ebe13bd5b8f57a778ebcaed6f0	2023-04-07T09:12:53.978	2023-04-07T09:13:16.240
В этой связи важно, чтобы подготовка учителей была адекватной и придавала им чувство уверенности и безопасности в процессе преподавания истории с применением <mark>похода</mark>, позволяющего учитывать различные точки зрения.	2				74e097e4-2e17-4a3b-b00a-95fc176be52d	00024bafed--642fde95bfbe7f7e1c3eea49	8f10d6ebe13bd5b8f57a778ebcaed6f0	2023-04-07T09:12:53.978	2023-04-07T09:13:16.240
"v) подготовил документальный фильм ""Фемицид, <mark>страсть</mark> или контроль"", в котором анализируется ответственность средств массовой информации в ходе уголовного судопроизводства;"	3				8dd6ed23-7e75-4086-986b-0546dfe18035	00024bafed--642fde95bfbe7f7e1c3eea49	8f10d6ebe13bd5b8f57a778ebcaed6f0	2023-04-07T09:12:53.978	2023-04-07T09:13:16.240
Речь идет о многочисленных случаях изнасилований, в том числе групповых, принуждения к браку, сексуального <mark>рабства</mark> и физических издевательств над женщинами и девочками.	2				d5351e10-ecdf-45f7-ae02-f4fd0a028a95	00024bafed--642fde95bfbe7f7e1c3eea49	8f10d6ebe13bd5b8f57a778ebcaed6f0	2023-04-07T09:12:53.978	2023-04-07T09:13:16.240
Основные публикации Организации Объединенных Наций: <<Глобальная перспектива в области биоразнообразия>>, <<Мировое экономическое положение и перспективы>>, <<Устойчивое развитие в XXI <mark>веке</mark>>>	2				1256ae32-0ba9-4b2d-9834-831c0f5783ab	00024bafed--642fde95bfbe7f7e1c3eea49	8f10d6ebe13bd5b8f57a778ebcaed6f0	2023-04-07T09:12:53.978	2023-04-07T09:13:16.240
"Фонд ""Лордина"" ведет строительство Института по <mark>овладению</mark> профессиональными навыками для лиц, содержащихся в лагере в Гамбаге, и жителей окрестных общин."	3				251200c7-b2b6-4d99-b0bb-2c0199fd36c3	00024bafed--642fde95bfbe7f7e1c3eea49	8f10d6ebe13bd5b8f57a778ebcaed6f0	2023-04-07T09:12:53.978	2023-04-07T09:13:16.240
42. <mark>Правительство</mark> Российской Федерации продолжает усиливать преследование инакомыслия путем ареста и преследования членов гражданского общества и критиков ее действий на Украине.	2				ffcde700-153a-46a7-9bf8-06e7f1318667	00024bafed--642fde95c211ef582511347f	0f71468418e7d2c3eefceb256136c2f9	2023-04-07T09:12:53.337	2023-04-07T09:13:19.248
Еще одна цель заключалась в создании электронной <mark>сети</mark> для ведения международного диалога по вопросам инвестиционной политики и передовой практики.	3				3fc4806f-d4ee-4af9-ab6d-494c82448bde	00024bafed--642fde95c211ef582511347f	0f71468418e7d2c3eefceb256136c2f9	2023-04-07T09:12:53.337	2023-04-07T09:13:19.248
Однако после начала <mark>восстания</mark> против режима Асада стало практикой фотографировать заключенных, подвергшихся пыткам и убитых во время пребывания в заключении.	3				87ea7b27-4e21-4306-883b-6495d3b4d875	00024bafed--642fde95c211ef582511347f	0f71468418e7d2c3eefceb256136c2f9	2023-04-07T09:12:53.337	2023-04-07T09:13:19.248
Возможность воздействия инновационных <mark>бизнес</mark>-моделей, реализуемых под руководством женщин, может стать ключом к преобразованию господствующей корпоративной культуры.	3				99bbd4be-d54d-4a78-89e3-efdd9729ff76	00024bafed--642fde95c211ef582511347f	0f71468418e7d2c3eefceb256136c2f9	2023-04-07T09:12:53.337	2023-04-07T09:13:19.248
Мы вновь обращаем внимание на опасность постоянных провокаций и подстрекательств внутри или вблизи мечети Аль-Акса, которая является первой <<киблой>> и третьей по значимости <mark>святыней</mark> ислама.	3				f3d676f0-a470-41ee-9110-72861049ccfe	00024bafed--642fde95c211ef582511347f	0f71468418e7d2c3eefceb256136c2f9	2023-04-07T09:12:53.337	2023-04-07T09:13:19.248
55. 14 января 2013 года Юлия <mark>Степанова</mark>, занимающаяся оказанием помощи политическим репрессированным, стала жертвой нападения двух неизвестных, когда возвращалась к себе домой в Минске.	3				acd473ce-cb6e-4b5e-b033-a5f4d749c5a1	00024bafed--642fde95c211ef582511347f	0f71468418e7d2c3eefceb256136c2f9	2023-04-07T09:12:53.337	2023-04-07T09:13:19.248
Например, согласно законам о коммерческой тайне информация должна представлять собой коммерческую ценность и служить интересам охраны коммерческой тайны, а не <mark>псалмов</mark> или фольклора.	4				49dd771e-63ac-43e0-9957-5979e4984093	00024bafed--642fde95c211ef582511347f	0f71468418e7d2c3eefceb256136c2f9	2023-04-07T09:12:53.337	2023-04-07T09:13:19.248
Фонд включил в свою программу вопросы прав <mark>человека</mark>, борьбы с торговлей детьми и образования молодежи с целью трудоустройства и открыл представительства в Гане и Либерии.	2				f2451a4d-f280-4d89-ae4c-e3da5b51c52d	00024bafed--642fde95c211ef582511347f	0f71468418e7d2c3eefceb256136c2f9	2023-04-07T09:12:53.337	2023-04-07T09:13:19.248
5. Комитет, возможно, пожелает рассмотреть предлагаемую форму реестра исключений и принять его на временной <mark>основе</mark> до официального утверждения Конференцией Сторон на ее первом совещании.	2				116d4e47-0f3d-43d3-a8aa-2b4176a02d49	00024bafed--642fde95c211ef582511347f	0f71468418e7d2c3eefceb256136c2f9	2023-04-07T09:12:53.337	2023-04-07T09:13:19.248
Правом на возмещение ущерба обладают, в частности, лица, необоснованно лишенные свободы вследствие допущенной <mark>ошибки</mark> или противоправной деятельности соответствующего органа (статья 560).	2				3365e881-66fa-4127-af1c-9e664fe79b17	00024bafed--642fde95c211ef582511347f	0f71468418e7d2c3eefceb256136c2f9	2023-04-07T09:12:53.337	2023-04-07T09:13:19.248
:: проверка результативности работы и бюджетирование служебной деятельности, Всемирный банк, Министерство финансов Российской федерации, <mark>Москва</mark>, март 2011 года.	1				27ca1e44-f345-4ad8-abc9-987f522effb3	00024bafed--642fde95c211ef582511349e	0715c710da066a1fa522b1ca0c241795	2023-04-07T09:12:53.934	2023-04-07T09:13:21.345
"47. Общий индекс потребительских цен (ИПЦ) использовался для расчета порогового <mark>значения</mark> (в терминах валового дохода предприятий в постоянных ценах), согласно которому в данном исследовании выделялись ""малые"" предприятия."	2				6b85a140-60c0-47dc-a81d-f41e6297edde	00024bafed--642fde95c211ef582511349e	0715c710da066a1fa522b1ca0c241795	2023-04-07T09:12:53.934	2023-04-07T09:13:21.345
Вместе с тем все подтвержденные <mark>доказательствами</mark> жалобы на превышение силами обороны и органами безопасности своих полномочий могут быть переданы для расследования в компетентные судебные инстанции.	1				e778105c-25d4-42e8-b0be-ee2fb704f245	00024bafed--642fde95c211ef582511349e	0715c710da066a1fa522b1ca0c241795	2023-04-07T09:12:53.934	2023-04-07T09:13:21.345
Продукция, содержащая КЦХП, включая краски, адгезивы, герметики, <mark>резину</mark> и пластмассы, могли быть импортированы в Канаду; считается, что объем такого импорта был небольшим (UNEP/FAO/RC/CRC.10/6, приложение II, п. 2.3.1).	1				44f8dc2a-9d76-4aec-bc1d-ebf403591c40	00024bafed--642fde95c211ef582511349e	0715c710da066a1fa522b1ca0c241795	2023-04-07T09:12:53.934	2023-04-07T09:13:21.345
Диффамация в <mark>печати</mark> регулируется Законом о подрывных и нежелательных публикациях (1968 года) и наказуема штрафом и тюремным заключением сроком до шести месяцев.	2				a846ee03-88cd-4b01-8be0-98dab297e0ee	00024bafed--642fde95c211ef582511349e	0715c710da066a1fa522b1ca0c241795	2023-04-07T09:12:53.934	2023-04-07T09:13:21.345
3.4.3.3 Оборудование устанавливают в соответствии со <mark>схемой</mark>, приведенной на рис. A5/7, и проверяют на утечку газа.	2				fdca3ea2-5a9c-4560-9b91-87bdaaa32950	00024bafed--642fde95c211ef582511349e	0715c710da066a1fa522b1ca0c241795	2023-04-07T09:12:53.934	2023-04-07T09:13:21.345
Благодаря современным научным исследованиям и этическим нормам человечество во все большей степени осознает многочисленные преимущества установления уважительных отношений с миром <mark>природы</mark>.	1				95a51504-ee01-4f3f-9f73-1ece5ae886e1	00024bafed--642fde95c211ef582511349e	0715c710da066a1fa522b1ca0c241795	2023-04-07T09:12:53.934	2023-04-07T09:13:21.345
Они принимают участие в проекте обсуждения преобразований с учетом гендерных аспектов и работают в тесном контакте с местными <mark>лидерами</mark>, женскими НПО, членами парламента и другими государственными структурами.	2				1b4104d0-f588-4ca2-a8a9-b2452e688c04	00024bafed--642fde95c211ef582511349e	0715c710da066a1fa522b1ca0c241795	2023-04-07T09:12:53.934	2023-04-07T09:13:21.345
Комитет считает, что в настоящем сообщении авторы не продемонстрировали того, что выводы суда по их делу достигли порога произвольности в оценке <mark>доказательств</mark> или были равнозначными отказу в правосудии.	1				dd21e753-1d86-4188-8328-2939f5a19997	00024bafed--642fde95c211ef582511349e	0715c710da066a1fa522b1ca0c241795	2023-04-07T09:12:53.934	2023-04-07T09:13:21.345
Этот <<финансовый <mark>обрыв</mark>>>, возникший в результате завершения деятельности миссии и отъезда ее персонала, был также отнесен к числу проблем, которые приходится решать странам в переходный период.	2				41684c64-0f46-4ef2-9347-6f9ddd66902f	00024bafed--642fde95c211ef582511349e	0715c710da066a1fa522b1ca0c241795	2023-04-07T09:12:53.934	2023-04-07T09:13:21.345
Поскольку Испания незаконно ушла от выполнения своей ответственности за деколонизацию территории, Организация Объединенных Наций несет признанную всеми ответственность за <mark>судьбу</mark> народа Западной Сахары.	2				dd072731-9d28-4a58-9e4b-518a302e7f73	00024bafed--642fde992d027f1176f9def1	346e2f68b9092f6311f8710c4258b8f2	2023-04-07T09:12:57.719	2023-04-07T09:13:29.853
Оппоненты выразили <mark>несогласие</mark> с решениями Всеобщего национального конгресса и организовали информационно-политическую кампанию с целью упразднить его, которая, однако, прошла с ограниченным успехом.	3				cf167a34-fb25-4adf-b77e-b69d67ece23e	00024bafed--642fde992d027f1176f9def1	346e2f68b9092f6311f8710c4258b8f2	2023-04-07T09:12:57.719	2023-04-07T09:13:29.853
В целом подход государства заключается в создании благоприятных условий для преобладающих традиционных <mark>конфессий</mark> - ислама и христианства.	4				a0d464e7-c2fd-450b-806b-60c3abaced6c	00024bafed--642fde992d027f1176f9def1	346e2f68b9092f6311f8710c4258b8f2	2023-04-07T09:12:57.719	2023-04-07T09:13:29.853
Что касается высшего образования, то квалификация рабочей силы не соответствует требованиям рынка и имеет место значительная <<утечка <mark>мозгов</mark>>> в страны Ближнего Востока.	2				7841e0ca-6c1a-4ae8-a7da-c61c2ec8fc9f	00024bafed--642fde992d027f1176f9def1	346e2f68b9092f6311f8710c4258b8f2	2023-04-07T09:12:57.719	2023-04-07T09:13:29.853
Поскольку <mark>женщины</mark> являются прирожденными руководителями и учителями, они должны иметь возможность совместно с мужчинами выполнять эти ключевые функции посредством таких мер, как:	2				aa1b2933-34b7-4a2c-a3d0-07336cf9ac1a	00024bafed--642fde992d027f1176f9def1	346e2f68b9092f6311f8710c4258b8f2	2023-04-07T09:12:57.719	2023-04-07T09:13:29.853
70. Некоторые сотрудники пограничных служб конфискуют личное имущество мигрантов, например удостоверения личности, <mark>деньги</mark> и мобильные телефоны, и не возвращают их, когда мигранты высылаются.	1				4ae44792-e016-44c9-8eca-06f8375030db	00024bafed--642fde992d027f1176f9def1	346e2f68b9092f6311f8710c4258b8f2	2023-04-07T09:12:57.719	2023-04-07T09:13:29.853
Регистрируют наивысший уровень шума звука по шкале А при открытии регулятора давления и при выпуске <mark>воздуха</mark> из систем рабочего и стояночного тормозов после их использования.	1				72486e07-d1c2-439d-9af3-d6203ede4b0a	00024bafed--642fde992d027f1176f9def1	346e2f68b9092f6311f8710c4258b8f2	2023-04-07T09:12:57.719	2023-04-07T09:13:29.853
