INPUT:text	OUTPUT:complexity	GOLDEN:complexity	HINT:text	HINT:default_language	ASSIGNMENT:task_id	ASSIGNMENT:assignment_id	ASSIGNMENT:worker_id	ASSIGNMENT:started	ASSIGNMENT:submitted
Расчет чистого изменения массы водорода во внутреннем пространстве производится для определения фонового <mark>уровня</mark> водорода в камере и скорости утечки.	1				324be3b3-d680-4859-8b3f-23c01314cf0b	00024bb00b--642fe000896cfd65ec4c3368	b425e1a2301b1ab1a09016b03ca0edd4	2023-04-07T09:18:56.738	2023-04-07T09:19:21.395
Она отметила, что значительная <mark>часть</mark> обсуждений на восьмой сессии касалась вопроса о физическом присутствии для определения факта наличия постоянного представительства.	1				7db9b312-1fab-4998-989b-6380d9666168	00024bb00b--642fe000896cfd65ec4c3368	b425e1a2301b1ab1a09016b03ca0edd4	2023-04-07T09:18:56.738	2023-04-07T09:19:21.395
К ним относится случай, произошедший в 2009 году, когда представители другой касты остановили похоронную <mark>процессию</mark> и избили членов общины далитов.	1				5ad8d65e-539d-452d-b7d4-47285bd0e18b	00024bb00b--642fe000896cfd65ec4c3368	b425e1a2301b1ab1a09016b03ca0edd4	2023-04-07T09:18:56.738	2023-04-07T09:19:21.395
Запасы <mark>мрамора</mark> в Афганистане составляют в общей сложности 9 млрд. тонн, и их стоимость оценивается в 150 - 200 млрд. долл. США.	1				afcbc30d-0d8c-43bf-a044-1708d9725af7	00024bb00b--642fe000896cfd65ec4c3368	b425e1a2301b1ab1a09016b03ca0edd4	2023-04-07T09:18:56.738	2023-04-07T09:19:21.395
По <mark>словам</mark> Совместного специального представителя, складывалось отчетливое впечатление того, что, выдвигая свои требования, делегация правительства следует тактике проволочек.	1				ab440ac5-cdb0-4612-b429-8f1998a52b0c	00024bb00b--642fe000896cfd65ec4c3368	b425e1a2301b1ab1a09016b03ca0edd4	2023-04-07T09:18:56.738	2023-04-07T09:19:21.395
Снижение <mark>тарифов</mark> привело к возникновению новых рыночных возможностей, но и одновременно с этим обнаружило серьезную проблему нетарифных мер и регулятивных барьеров на пути торговли.	3				d9968e75-549e-40eb-a96d-2f421b39f75d	00024bb00b--642fe0062d027f1176fa1064	3e22f87dd8e6d99a6c33a9d8cce233a2	2023-04-07T09:19:02.869	2023-04-07T09:19:45.332
Власти предоставляют также средства в поддержку ассоциации, занимающейся проблемами гендерной и этнической принадлежности, -- НКО <<<mark>Элла</mark>>> (Центр гендерной и этнической экспертизы) (пункт 118 доклада 2012 года).	4				7fa3e162-c1a4-4d55-9fe3-5091efee4c58	00024bb00b--642fe0062d027f1176fa1064	3e22f87dd8e6d99a6c33a9d8cce233a2	2023-04-07T09:19:02.869	2023-04-07T09:19:45.332
На конец 2012 года женщины-<mark>полицейские</mark> составляли лишь 6% от общего контингента работников ППСК; тогда как, как показывают сводки, с 2010 года рост служащих из числа женщин составил 21%.	2				5bd792dd-0fe2-4648-9e83-179ffb4cf5ab	00024bb00b--642fe0062d027f1176fa1064	3e22f87dd8e6d99a6c33a9d8cce233a2	2023-04-07T09:19:02.869	2023-04-07T09:19:45.332
Крест кавалера <mark>ордена</mark> Polonia Restituta (1985 год) и прочие высокие награды Польши, Германии и Вьетнама	2				40ae0cff-8300-4146-ad47-361e272e82b1	00024bb00b--642fe0062d027f1176fa1064	3e22f87dd8e6d99a6c33a9d8cce233a2	2023-04-07T09:19:02.869	2023-04-07T09:19:45.332
ii) <mark>расстояние</mark> между двумя смежными/прилегающими друг к другу отдельными частями, измеренное перпендикулярно исходной оси, не превышает 15 мм.	2				313b7e8c-e517-45e1-9d3d-009cd82f00a0	00024bb00b--642fe0062d027f1176fa1064	3e22f87dd8e6d99a6c33a9d8cce233a2	2023-04-07T09:19:02.869	2023-04-07T09:19:45.332
12. Сообщения о случаях насильственного или недобровольного исчезновения обычно представляются Рабочей группе семьей или <mark>друзьями</mark> исчезнувшего лица.	2				ba6d7a30-8094-4f26-afdc-1f04b23cdaad	00024bb00b--642fe0062d027f1176fa1064	3e22f87dd8e6d99a6c33a9d8cce233a2	2023-04-07T09:19:02.869	2023-04-07T09:19:45.332
Они выразили обеспокоенность также по поводу дестабилизирующих действий вооруженных групп, включая Демократические силы освобождения Руанды (ДСОР), Альянс демократических сил (АДС) и <<Армию сопротивления <mark>Бога</mark>>> (ЛРА).	3				a5f98aa4-cd6f-49a6-8079-0b3bc3d05a81	00024bb00b--642fe0062d027f1176fa1064	3e22f87dd8e6d99a6c33a9d8cce233a2	2023-04-07T09:19:02.869	2023-04-07T09:19:45.332
31. Последствия кризисов для городов порождают ряд взаимосвязанных факторов, таких как ухудшение условий <mark>проживания</mark> в городах, нарушение территориального единства, разрушение социальной инфраструктуры, административные проблемы или институциональная нестабильность.	3				b7d32b04-7d68-404c-8f6f-b3681f57717f	00024bb00b--642fe0062d027f1176fa1064	3e22f87dd8e6d99a6c33a9d8cce233a2	2023-04-07T09:19:02.869	2023-04-07T09:19:45.332
Как отмечается в пункте 10 выше, Консультативный комитет не возражает против предлагаемого продления <mark>срока</mark> полномочий трех судей ad litem.	2				9dc85c50-ef5c-422c-8988-02e349c3a2be	00024bb00b--642fe0062d027f1176fa1064	3e22f87dd8e6d99a6c33a9d8cce233a2	2023-04-07T09:19:02.869	2023-04-07T09:19:45.332
b) размещать свой персонал, космические аппараты, оборудование, установки, станции и сооружения в любом месте поверхности Луны или ее <mark>недр</mark>.	2				232abb44-6f0c-4ef5-9cd0-64c73396e2a4	00024bb00b--642fe0062d027f1176fa1064	3e22f87dd8e6d99a6c33a9d8cce233a2	2023-04-07T09:19:02.869	2023-04-07T09:19:45.332
157. Ряд делегаций выразили возмущение похищением 223 нигерийских школьниц, ставшим одним из самых грубых нарушений <mark>прав</mark> человека.	2				80bcc0f6-2e57-4e86-99ac-c24ebd5c3323	00024bb00b--642fe006cfff71646bd74e65	922ae0fd3f6a21f5200e915f2292c77f	2023-04-07T09:19:02.263	2023-04-07T09:20:10.887
Таким образом, в целом человеческие ошибки в условиях дорожного движения можно подразделить на непреднамеренные ошибки (оплошности, промахи, упущения и т.д.) и преднамеренные <mark>нарушения</mark>.	1				daa83aa7-008a-432c-87ff-9733dc74189e	00024bb00b--642fe006cfff71646bd74e65	922ae0fd3f6a21f5200e915f2292c77f	2023-04-07T09:19:02.263	2023-04-07T09:20:10.887
Несмотря на достигнутый прогресс, сохраняется обеспокоенность по поводу того, что разрешение досудебного содержания задержанных лиц под стражей в течение срока до 18 <mark>дней</mark> без решения суда является нарушением международных обязательств.	1				f095967f-9794-4646-bd32-29cb21efc05f	00024bb00b--642fe006cfff71646bd74e65	922ae0fd3f6a21f5200e915f2292c77f	2023-04-07T09:19:02.263	2023-04-07T09:20:10.887
Его делегация надеется, что стороны проявят <mark>мудрость</mark>, ответственность и приверженность основополагающим принципам Устава Организации Объединенных Наций и незамедлительно приступят к межправительственным переговорам с целью урегулирования этой ситуации.	1				767d4b6b-62fa-44ee-89b6-98e206858fb9	00024bb00b--642fe006cfff71646bd74e65	922ae0fd3f6a21f5200e915f2292c77f	2023-04-07T09:19:02.263	2023-04-07T09:20:10.887
134.143 продолжать деятельность по реализации права человека на <mark>воду</mark> в рамках резолюции 64/292 Генеральной Ассамблеи (Боливия (Многонациональное Государство));	1				8493d110-03b2-4342-9818-fd2cd5c4d119	00024bb00b--642fe006cfff71646bd74e65	922ae0fd3f6a21f5200e915f2292c77f	2023-04-07T09:19:02.263	2023-04-07T09:20:10.887
Подпись может быть отпечатана или заменена штампом с помощью счетной <mark>машинки</mark> или другим подходящим способом.	2				6096b1d4-0fe6-4c0d-8e0d-e8b39680c6e9	00024bb00b--642fe006cfff71646bd74e65	922ae0fd3f6a21f5200e915f2292c77f	2023-04-07T09:19:02.263	2023-04-07T09:20:10.887
К ним относится информация, подстрекающая к <mark>ненависти</mark> и дискриминации по признаку расы, вероисповедания и сексуальной ориентации или способствующая гиперсексуализации детей.	1				24610b7a-fe73-48ff-bbc8-d786de5ae2e6	00024bb00b--642fe006cfff71646bd74e65	922ae0fd3f6a21f5200e915f2292c77f	2023-04-07T09:19:02.263	2023-04-07T09:20:10.887
"Регулярное предоставление общественности информации подтвердило твердую приверженность и решимость МВД РС сделать свою работу публичной и транспарентной, а также ""рассекреченной"" в подлинном смысле этого <mark>слова</mark>."	2				11551673-a5a0-4939-b46f-183b855c3175	00024bb00b--642fe006cfff71646bd74e65	922ae0fd3f6a21f5200e915f2292c77f	2023-04-07T09:19:02.263	2023-04-07T09:20:10.887
1. Грузия -- страна, площадь территории которой составляет около 70 000 кв. км и которая расположена в южном предгорье Большого Кавказского <mark>хребта</mark> и на юго-восточном побережье Чёрного моря.	2				cf0cf8c0-39c1-4c2a-b977-7d3e8ab6ec86	00024bb00b--642fe006cfff71646bd74e65	922ae0fd3f6a21f5200e915f2292c77f	2023-04-07T09:19:02.263	2023-04-07T09:20:10.887
В развивающихся странах и странах с переходной экономикой показатели уровня безработицы различаются, при этом крайне высокая структурная безработица наблюдается в Северной Африке и Западной <mark>Азии</mark>, особенно среди молодежи.	2				99914da0-a797-46ec-b818-a3e680464de2	00024bb00b--642fe006cfff71646bd74e65	922ae0fd3f6a21f5200e915f2292c77f	2023-04-07T09:19:02.263	2023-04-07T09:20:10.887
27. С декабря 2011 года Словения является полноправным членом Международной <mark>организации</mark> по сотрудничеству в увековечивании и изучении Холокоста.	2				34bbf29b-2534-4adf-847f-e866f6d5d3cf	00024bb00b--642fe008fcf99b3fe7a151e3	442d9ba94187b3778476e6208d19dff1	2023-04-07T09:19:04.254	2023-04-07T09:20:52.396
Наряду с прочими африканскими странами Лесото участвовало в разработке концептуального документа о повестке дня в области развития на <mark>период</mark> после 2015 года.	2				5486e3a5-4df5-4820-9a15-43d1c33fcf7d	00024bb00b--642fe008fcf99b3fe7a151e3	442d9ba94187b3778476e6208d19dff1	2023-04-07T09:19:04.254	2023-04-07T09:20:52.396
Согласно многочисленным источникам и сообщениям в средствах массовой информации, эти грузы доставлялись через такие города, как Саллум, Мерса Матрух, <mark>Александрия</mark>, Кир и Суэц.	2				f85e80f6-a2fa-4611-b557-1e7f934d1885	00024bb00b--642fe008fcf99b3fe7a151e3	442d9ba94187b3778476e6208d19dff1	2023-04-07T09:19:04.254	2023-04-07T09:20:52.396
Система предназначена для оповещения о непосредственной угрозе или опасности всех лиц, находящихся в <mark>радиусе</mark> ее действия.	2				a26668dc-c7cc-45ef-93d7-850b910ef0d2	00024bb00b--642fe008fcf99b3fe7a151e3	442d9ba94187b3778476e6208d19dff1	2023-04-07T09:19:04.254	2023-04-07T09:20:52.396
Затем вторая рабочая группа Комитета открытого состава рассмотрит эти <mark>рекомендации</mark> и представит свои выводы Совету Лиги на уровне министров на его 143-й очередной сессии.	2				27c6885b-a466-4863-9c20-9133350ca3c0	00024bb00b--642fe008fcf99b3fe7a151e3	442d9ba94187b3778476e6208d19dff1	2023-04-07T09:19:04.254	2023-04-07T09:20:52.396
Чем должны быть ограничены со стороны носа и <mark>кормы</mark> трюмы сухогрузных судов, перевозящих опасные грузы?	3				888f8232-425f-4c05-b353-11c8a855a6e0	00024bb00b--642fe008fcf99b3fe7a151e3	442d9ba94187b3778476e6208d19dff1	2023-04-07T09:19:04.254	2023-04-07T09:20:52.396
4.6 Государство-участник далее отдельно освещает <mark>сущность</mark>, основы и содержание Хартии мира и национального примирения, а также нормативно-правовых актов, определяющих порядок ее осуществления.	3				9c15259f-196f-453d-88f6-346b5c78beb7	00024bb00b--642fe008fcf99b3fe7a151e3	442d9ba94187b3778476e6208d19dff1	2023-04-07T09:19:04.254	2023-04-07T09:20:52.396
1.3.3.5 Блок <mark>фильтр</mark>одержателя должен иметь конструкцию, обеспечивающую равномерное распределение газового потока по площади пятна осаждаемых на фильтр частиц.	2				21318fe3-ded5-46c2-bad7-aabc68921612	00024bb00b--642fe008fcf99b3fe7a151e3	442d9ba94187b3778476e6208d19dff1	2023-04-07T09:19:04.254	2023-04-07T09:20:52.396
17. Информацию о делегатах (имя и <mark>фамилия</mark>, звание/должность, место работы и личный адрес электронной почты) следует не позднее среды, 1 октября 2014 года, направить в секретариат Конференции.	2				14b9cd84-42c5-4d51-9bce-f65b4aa9aee5	00024bb00b--642fe008fcf99b3fe7a151e3	442d9ba94187b3778476e6208d19dff1	2023-04-07T09:19:04.254	2023-04-07T09:20:52.396
По поручению правительства Государства Палестина обращаю Ваше внимание на эскалацию актов израильской <mark>агрессии</mark>, провокаций и подстрекательства в оккупированном Восточном Иерусалиме, и особенно в Аль-Харам аш-Шарифе, где расположена мечеть Аль-Акса.	2				773345d9-dc56-4f4d-955c-e0e352d3de18	00024bb00b--642fe008fcf99b3fe7a151e3	442d9ba94187b3778476e6208d19dff1	2023-04-07T09:19:04.254	2023-04-07T09:20:52.396
24. Сессию открыл заместитель Председателя на сессиях Комитета в 2013 году <mark>Петер</mark> Вербрюгге (Бельгия), который временно выполнял функции Председателя.	4				afc13670-8640-4c2e-a9a3-ebc0316ad029	00024bb00b--642fe00b2d027f1176fa10c1	ffc1275e59e3236a10ce96555fa48bdf	2023-04-07T09:19:07.721	2023-04-07T09:22:51.188
20. БАПОР продолжало внедрять новые банковские онлайн-программы по микрофинансированию, которые позволяют оптимизировать и усовершенствовать процесс ведения счетов <mark>клиентов</mark>, а также управление кредитными операциями, счетами и финансами.	1				e7a3ddd6-14dd-4513-80fc-d5bb240928e8	00024bb00b--642fe00b2d027f1176fa10c1	ffc1275e59e3236a10ce96555fa48bdf	2023-04-07T09:19:07.721	2023-04-07T09:22:51.188
Цена этого бездействия недопустимо высока: каждый год тысячи мигрантов гибнут на море или при пересечении международных <mark>границ</mark>.	1				c1fe5b85-0a55-474e-8d14-0cdb2a17a221	00024bb00b--642fe00b2d027f1176fa10c1	ffc1275e59e3236a10ce96555fa48bdf	2023-04-07T09:19:07.721	2023-04-07T09:22:51.188
1. Давно признано, что воздействие на окружающую среду во время вооруженного конфликта и после него может создавать серьезную угрозу для <mark>уклада</mark> жизни и даже самого существования людей и общин.	2				60e44514-fbb8-43ec-9144-08176b84f4e2	00024bb00b--642fe00b2d027f1176fa10c1	ffc1275e59e3236a10ce96555fa48bdf	2023-04-07T09:19:07.721	2023-04-07T09:22:51.188
174. Внешний ревизор изучил предоставленный ЮНИДО <mark>файл</mark> конфигурации маршрутизатора SAP и установил, что записи в таблице маршрутизатора SAP не имеют никакой утверждающей документации.	1				30fd5c48-83dc-455e-b9cb-a7f63eb684b4	00024bb00b--642fe00b2d027f1176fa10c1	ffc1275e59e3236a10ce96555fa48bdf	2023-04-07T09:19:07.721	2023-04-07T09:22:51.188
Предостная мышца представляет собой конусообразную мышцу, расположенную латерально к лопаточной кости с краниальной стороны лопаточного <mark>гребня</mark>.	3				4d704da3-cc82-4535-8814-a8cb5c92fef5	00024bb00b--642fe00b2d027f1176fa10c1	ffc1275e59e3236a10ce96555fa48bdf	2023-04-07T09:19:07.721	2023-04-07T09:22:51.188
Двое палестинских террористов, вооруженных ножами, топорами и пистолетом, ворвались в синагогу и зверски набросились на еврейских прихожан, собравшихся для утренней <mark>молитвы</mark>.	1				bd7813c9-2b7b-490f-a860-540b77fa37ed	00024bb00b--642fe00b2d027f1176fa10c1	ffc1275e59e3236a10ce96555fa48bdf	2023-04-07T09:19:07.721	2023-04-07T09:22:51.188
13. Для данной региональной оценки необходимо работать с использованием существующих официальных и неофициальных <mark>сетей</mark>, действуя во всех масштабах от глобального до национального и - в идеале - субнационального.	1				191cbd0c-0e49-4f2a-9758-cba186530f04	00024bb00b--642fe00b2d027f1176fa10c1	ffc1275e59e3236a10ce96555fa48bdf	2023-04-07T09:19:07.721	2023-04-07T09:22:51.188
4. Если Интернет широко признается как важнейший инструмент содействия развитию и защиты прав человека, то по логике <mark>вещей</mark> Интернет должен служить также и важнейшим инструментом развития детей.	1				d141c90b-65b3-4eba-9c8c-99be63b3a26f	00024bb00b--642fe00b2d027f1176fa10c1	ffc1275e59e3236a10ce96555fa48bdf	2023-04-07T09:19:07.721	2023-04-07T09:22:51.188
"d) обзор РТС ""нового поколения"", в том числе положений, касающихся ""глубокой"" интеграции, и взаимосвязи между <mark>товарами</mark> и услугами;"	1				ec52de2a-645c-4748-a47a-fa9af8abd8a0	00024bb00b--642fe00b2d027f1176fa10c1	ffc1275e59e3236a10ce96555fa48bdf	2023-04-07T09:19:07.721	2023-04-07T09:22:51.188
"* <mark>Фары</mark> с модулем СИД класса А, предусмотренным Правилами № 113, только на транспортных средствах, максимальная расчетная скорость которых не превышает 25 км/ч""."	1				dc9d1cdd-cf8f-4a98-aff4-18e15773fe01	00024bb00b--642fe00cc3f515219e8392f0	b17a91488e7cb0b610057bf13ddb935e	2023-04-07T09:19:08.118	2023-04-07T09:20:27.452
Также имеется риск для <mark>птиц</mark> и млекопитающих, обусловленный потреблением мертвых насекомых, а также - возможно - другими путями воздействия.	1				121bd1f7-1082-4dbb-aa22-ec3e3eaa692c	00024bb00b--642fe00cc3f515219e8392f0	b17a91488e7cb0b610057bf13ddb935e	2023-04-07T09:19:08.118	2023-04-07T09:20:27.452
Я хочу поблагодарить тех военнослужащих Украины, которые не пошли на кровопролитие и не запятнали себя <mark>кровью</mark>.	1				d97d2203-4cc6-47d1-9a07-03d4f8c4a351	00024bb00b--642fe00cc3f515219e8392f0	b17a91488e7cb0b610057bf13ddb935e	2023-04-07T09:19:08.118	2023-04-07T09:20:27.452
Медоносная <mark>пчела</mark>, ЛД50 при контакте (48-часовое исследование острой токсичности): 0,16 нг/пчела (FAO 2004); 0,31 мкг/пчела (EU 2002)	1				31d2fdf6-b163-433c-9d1a-4ad0a256c922	00024bb00b--642fe00cc3f515219e8392f0	b17a91488e7cb0b610057bf13ddb935e	2023-04-07T09:19:08.118	2023-04-07T09:20:27.452
9. Неизбежные отклонения от рекомендуемых определений и классификаций, обусловленные особенностями национальной образовательной системы, должны поясняться в <mark>материалах</mark> переписи и/или соответствующих метаданных.	1				752b3449-418f-4a06-9949-b6672c267c5a	00024bb00b--642fe00cc3f515219e8392f0	b17a91488e7cb0b610057bf13ddb935e	2023-04-07T09:19:08.118	2023-04-07T09:20:27.452
Терроризм не должен ассоциироваться ни с какими религией, расой, верой, <mark>теологией</mark>, ценностями, культурой, обществом или группой, и никакая религия или религиозная доктрина не должна изображаться как поощряющая или пропагандирующая терроризм.	1				a1111d7b-abb6-4042-aa01-755ab370a7bf	00024bb00b--642fe00cc3f515219e8392f0	b17a91488e7cb0b610057bf13ddb935e	2023-04-07T09:19:08.118	2023-04-07T09:20:27.452
8. Основным средством для отказа в гражданских правах до сих пор является разрешительный порядок, крайне стесняющий их <mark>реализацию</mark>.	1				9c9dd331-80ce-4598-bf83-7acad539a362	00024bb00b--642fe00cc3f515219e8392f0	b17a91488e7cb0b610057bf13ddb935e	2023-04-07T09:19:08.118	2023-04-07T09:20:27.452
Расчет массы выбросов за цикл методом <mark>интегрирования</mark> мгновенных значений выбросов и значений u, взятых из таблицы 5 (пункт 8.4.2.3)	3				49424b26-d097-4ff8-84ea-4107bd187f1c	00024bb00b--642fe00cc3f515219e8392f0	b17a91488e7cb0b610057bf13ddb935e	2023-04-07T09:19:08.118	2023-04-07T09:20:27.452
