INPUT:text	OUTPUT:complexity	GOLDEN:complexity	HINT:text	HINT:default_language	ASSIGNMENT:task_id	ASSIGNMENT:assignment_id	ASSIGNMENT:worker_id	ASSIGNMENT:started	ASSIGNMENT:submitted
69. Боевики ИГИШ избивают лиц, находящихся в центрах содержания под стражей в мухафазах Эр-Ракка и Алеппо, во время <mark>допросов</mark>.	1				0746a416-c604-4987-a8c6-02b4c07ad43d	00024bb00b--642fdde1dc4be92e38c3b8c8	bd06b4589827a2162c79f5d76770224b	2023-04-07T09:09:53.808	2023-04-07T09:10:11.763
В приложении IV подробно описываются нападения на гражданских лиц, которые привели к гибели нескольких человек. 24 июня на улице Бейт-ат-Тавеел в пригороде Вади-ад-Дахаб в городе Хомс взорвался начиненный <mark>взрывчаткой</mark> автомобиль.	1				f3072a34-a507-423b-9958-9cbd7630ba37	00024bb00b--642fdde1dc4be92e38c3b8c8	bd06b4589827a2162c79f5d76770224b	2023-04-07T09:09:53.808	2023-04-07T09:10:11.763
"3.2.4.3.2 В периоды выдерживания между отдельными циклами ВЦИМГ <mark>выключатель</mark> зажигания должен находиться в положении ""выключено"", а ПЭАС не подзаряжают от внешнего источника электроэнергии."	1				27228ed3-f67f-4671-bb62-d57a0fe63a33	00024bb00b--642fdde1dc4be92e38c3b8c8	bd06b4589827a2162c79f5d76770224b	2023-04-07T09:09:53.808	2023-04-07T09:10:11.763
При <mark>зарождении</mark> организации женщины в Кении сталкивались с целым рядом проблем, большинство из которых были предметом обсуждения в Пекине.	1				6704a0cd-7e2f-4e67-852c-84966a66427d	00024bb00b--642fdde1dc4be92e38c3b8c8	bd06b4589827a2162c79f5d76770224b	2023-04-07T09:09:53.808	2023-04-07T09:10:11.763
1.3 В соответствии с пунктом 10 правила 70 его правил процедуры, Комитет просил стороны представить дополнительные письменные <mark>объяснения</mark> в связи со следующими вопросами:	3				2a1e36e8-0999-4d29-b258-50d846c85f07	00024bb00b--642fdde1dc4be92e38c3b8c8	bd06b4589827a2162c79f5d76770224b	2023-04-07T09:09:53.808	2023-04-07T09:10:11.763
1. Каждое судно, за исключением малых и морских судов, должно иметь на корпусе или на прочно прикрепленных <mark>щитках</mark> или табличках следующие опознавательные знаки:	1				b35e806c-8791-4b58-a464-036c5fb8c8c2	00024bb00b--642fdde1dc4be92e38c3b8c8	bd06b4589827a2162c79f5d76770224b	2023-04-07T09:09:53.808	2023-04-07T09:10:11.763
Государство-участник считает, что выражение лишь такого рода <mark>несогласия</mark> является недостаточным для подтверждения автором ее утверждений о нарушении положений статей 1 - 3 Конвенции.	1				79613b27-5eb7-4370-a8b6-44e582be8ddd	00024bb00b--642fdde1dc4be92e38c3b8c8	bd06b4589827a2162c79f5d76770224b	2023-04-07T09:09:53.808	2023-04-07T09:10:11.763
Государствам-членам оказывалась также <mark>поддержка</mark> в целях обеспечения лучшего понимания режима санкций и содействия осуществлению санкционных мер.	1				b675a8d6-0b21-4293-ba38-15030658c68b	00024bb00b--642fdde1dc4be92e38c3b8c8	bd06b4589827a2162c79f5d76770224b	2023-04-07T09:09:53.808	2023-04-07T09:10:11.763
10. Г-н Гильерме де Агияр <mark>Патриота</mark> (Бразилия) говорит, что его делегация поддерживает представление данного проекта резолюции.	1				687161ef-f20c-4344-82ad-9cc901ed5426	00024bb00b--642fdde1dc4be92e38c3b8c8	bd06b4589827a2162c79f5d76770224b	2023-04-07T09:09:53.808	2023-04-07T09:10:11.763
"Боевиков из ""Front démocratique du peuple centrafricain"" (<<Демократический фронт центральноафриканского народа>>) и группы <<<mark>Революция</mark> и справедливость>> видели передвигающимися пешком или, гораздо реже, на мотоциклах."	1				892a8659-edff-44a4-950a-ba0a6e48d814	00024bb00b--642fdde1dc4be92e38c3b8c8	bd06b4589827a2162c79f5d76770224b	2023-04-07T09:09:53.808	2023-04-07T09:10:11.763
Кроме того, согласно сообщениям, увеличилось число случаев родов на <mark>дому</mark>, что повышает степень риска для женщин и их детей.	1				2c5e05da-6de1-4896-abf3-1b5986f96aa2	00024bb00b--642fddefcfff71646bd6fc9c	fc953d2e0add66c37ce69e669dd80d0b	2023-04-07T09:10:07.172	2023-04-07T09:10:46.479
Несмотря на короткий период полураспада в окружающей среде, токсичность фентиона имеет большое влияние на <mark>птиц</mark> и устьевые/морские беспозвоночные организмы.	1				dd5c1bef-f1b3-4d0c-9cd4-b5f2aca0a763	00024bb00b--642fddefcfff71646bd6fc9c	fc953d2e0add66c37ce69e669dd80d0b	2023-04-07T09:10:07.172	2023-04-07T09:10:46.479
"Учетные записи шести сотрудников в рамках системы ""Sun"", которые ушли из Трибунала в течение рассматриваемого <mark>периода</mark>, были не деактивированы, а удалены."	2				9d925277-887e-4ad7-af95-cc2de2a39729	00024bb00b--642fddefcfff71646bd6fc9c	fc953d2e0add66c37ce69e669dd80d0b	2023-04-07T09:10:07.172	2023-04-07T09:10:46.479
Одна девушка по имени Малала Юсафзай заняла твердую позицию, а затем получила поддержку от своего <mark>отца</mark>.	1				046ce9a2-24a6-4327-be92-53e516807fa0	00024bb00b--642fddefcfff71646bd6fc9c	fc953d2e0add66c37ce69e669dd80d0b	2023-04-07T09:10:07.172	2023-04-07T09:10:46.479
В рамках усилий по восстановлению и стабилизации МИНУСМА и учреждения Организации Объединенных Наций занимаются разработкой совместного и скоординированного плана в поддержку верховенства права на севере Мали и перевода административных <mark>структур</mark>.	2				02b0ebe6-8431-40a6-a9eb-1e008ce326c7	00024bb00b--642fddefcfff71646bd6fc9c	fc953d2e0add66c37ce69e669dd80d0b	2023-04-07T09:10:07.172	2023-04-07T09:10:46.479
Центр Организации Объединенных Наций по обучению и документации в области <mark>прав</mark> человека для Юго-Западной Азии и Арабского региона	2				8f4d8928-fa69-4c32-9cad-6b619a100f9e	00024bb00b--642fddefcfff71646bd6fc9c	fc953d2e0add66c37ce69e669dd80d0b	2023-04-07T09:10:07.172	2023-04-07T09:10:46.479
Если при применении телесного или психологического наказания какое-либо лицо нарушит вышеупомянутые нормы и подвергнет <mark>питомцев</mark> учреждения физическому или психическому насилию, оно может быть доставлено к следственному судье;	2				422238cc-307e-40e1-a780-64fedce79579	00024bb00b--642fddefcfff71646bd6fc9c	fc953d2e0add66c37ce69e669dd80d0b	2023-04-07T09:10:07.172	2023-04-07T09:10:46.479
Поощрение и защита прав человека могут быть обеспечены только на основе подлинного международного сотрудничества, осуществляемого в соответствии с принципами <mark>объективности</mark>, беспристрастности и неизбирательности.	2				689ba439-ccbd-437f-afa9-b5ae9fb77012	00024bb00b--642fddefcfff71646bd6fc9c	fc953d2e0add66c37ce69e669dd80d0b	2023-04-07T09:10:07.172	2023-04-07T09:10:46.479
Кроме того, Совет принял к сведению намерение Генерального секретаря развернуть подразделение стационарного охранения для укрепления безопасности <mark>комплексов</mark> МООНСОМ.	4				4da20c9c-078b-417f-a967-cfee59eb77e3	00024bb00b--642fddefcfff71646bd6fc9c	fc953d2e0add66c37ce69e669dd80d0b	2023-04-07T09:10:07.172	2023-04-07T09:10:46.479
По прибытии в аэропорт Могадишо, где пришлось усмирить вооруженные <mark>волнения</mark>, он был помещен под домашний арест.	2				4ba48755-91d1-4737-bcb6-86c87b34c9e2	00024bb00b--642fddefcfff71646bd6fc9c	fc953d2e0add66c37ce69e669dd80d0b	2023-04-07T09:10:07.172	2023-04-07T09:10:46.479
Благодаря процессу обновления НПВ, который в настоящее время проходит в большинстве стран, будет получена дополнительная информация о ПФОС, ее <mark>солях</mark> и ПФОСФ.	1				cc358a8d-9d33-4f19-8f48-2e4695afcfb7	00024bb00b--642fddf69e2e732523889776	bd06b4589827a2162c79f5d76770224b	2023-04-07T09:10:14.650	2023-04-07T09:10:29.573
Кроме того, не имея своих структур на местах, ЮНКТАД активно поддерживает связи с журналистами в таких крупных мировых центрах СМИ, как Лондон, <mark>Париж</mark>, Бангкок, Нью-Дели, Йоханнесбург и Буэнос-Айрес.	1				836056c3-7b97-4cee-b247-cf3cfc772ed8	00024bb00b--642fddf69e2e732523889776	bd06b4589827a2162c79f5d76770224b	2023-04-07T09:10:14.650	2023-04-07T09:10:29.573
Вследствие различий во <mark>взглядах</mark> ее членов зачастую им было трудно достичь согласия, в частности, в отношении принятия соответствующих мер с целью оптимального решения проблемы гендерного насилия.	1				64e7544f-66a5-407f-88ce-25727821a3d1	00024bb00b--642fddf69e2e732523889776	bd06b4589827a2162c79f5d76770224b	2023-04-07T09:10:14.650	2023-04-07T09:10:29.573
:: 29 июня больница <<Восток>> в Кафранбеле, Идлиб, подверглась нападению, повлекшему гибель двух человек и повреждение <mark>здания</mark> больницы.	1				b65ff612-7add-443a-92c9-ef8cefbfbc66	00024bb00b--642fddf69e2e732523889776	bd06b4589827a2162c79f5d76770224b	2023-04-07T09:10:14.650	2023-04-07T09:10:29.573
Он продолжает испытывать обеспокоенность в связи с продолжающимися задержками с внедрением системы организации пайкового <mark>довольствия</mark>.	2				f4eddc84-be43-43ad-9ac9-ffd48d5bbf01	00024bb00b--642fddf69e2e732523889776	bd06b4589827a2162c79f5d76770224b	2023-04-07T09:10:14.650	2023-04-07T09:10:29.573
Истинная сущность США -- <mark>царства</mark> расовой дискриминации -- проявилась в прошлом году, когда Суд Флориды вынес оправдательный приговор белому полицейскому, застрелившему ни в чем не повинного чернокожего мальчика.	1				617d7cc6-aa84-45d7-a42f-07ff9799d0f8	00024bb00b--642fddf69e2e732523889776	bd06b4589827a2162c79f5d76770224b	2023-04-07T09:10:14.650	2023-04-07T09:10:29.573
Успех, которого удалось добиться в древнем городе Хомс, является всего лишь одним из примеров результативности этой стратегии, а ему предшествовали <mark>успехи</mark> в Риф-Димашке, Алеппо, Хаме и других мухафазах.	1				43cac456-f1ee-49fc-b04e-85fdd9881b5b	00024bb00b--642fddf69e2e732523889776	bd06b4589827a2162c79f5d76770224b	2023-04-07T09:10:14.650	2023-04-07T09:10:29.573
"Она также сообщила о важном информационно-просветительском проекте в области борьбы с насилием в отношении женщин, который называется ""<mark>ВЕСНА</mark> − жизнь без насилия""."	1				2f0888dc-2572-43b4-9964-2b3f1f0c63ed	00024bb00b--642fddf69e2e732523889776	bd06b4589827a2162c79f5d76770224b	2023-04-07T09:10:14.650	2023-04-07T09:10:29.573
5. Сообщается, что утром 27 декабря 2012 года г-н Куан был арестован сотрудниками полиции рядом со своим домом, когда он провожал свою <mark>дочь</mark> в ханойскую школу.	1				80eed970-ed06-4b61-a73c-e89e6e25c2e9	00024bb00b--642fddf69e2e732523889776	bd06b4589827a2162c79f5d76770224b	2023-04-07T09:10:14.650	2023-04-07T09:10:29.573
За время своего существования целевые группы проделали работу по <mark>существу</mark>, внеся ценный вклад в выполнение цикличного плана работы.	1				e952dfa3-93f1-42e4-ba24-22e2937322f9	00024bb00b--642fddf69e2e732523889776	bd06b4589827a2162c79f5d76770224b	2023-04-07T09:10:14.650	2023-04-07T09:10:29.573
32. По состоянию на 27 мая 2014 года задолженность перед странами, предоставляющими <mark>контингенты</mark>, по выплате средств на покрытие связанных с контингентами расходов составила в общей сложности 2,9 млн. долл. США.	4				17863c37-2eb9-4d06-9db1-44b77e6e8c40	00024bb00b--642fde070ebcfb11a8e7877c	bd06b4589827a2162c79f5d76770224b	2023-04-07T09:10:31.852	2023-04-07T09:11:32.584
1. Смесевые топлива, состоящие из твердых и жидких горючих компонентов, например борсодержащая <mark>суспензия</mark>, с удельной теплотворной способностью на единицу массы 40 x 106 Дж/кг или более;	2				ba23f2e2-ea52-4cf2-8ed3-53001ddfb5b8	00024bb00b--642fde070ebcfb11a8e7877c	bd06b4589827a2162c79f5d76770224b	2023-04-07T09:10:31.852	2023-04-07T09:11:32.584
Тазобедренный отруб получают из задней четвертины (1010), предварительно удалив одним куском вырезку (2150) от брюшной поверхности поясничных <mark>позвонков</mark> и боковой поверхности подвздошной кости.	1				da4fc5c0-0fc5-44c0-afa6-a61dc6477a21	00024bb00b--642fde070ebcfb11a8e7877c	bd06b4589827a2162c79f5d76770224b	2023-04-07T09:10:31.852	2023-04-07T09:11:32.584
При осуществлении универсальной юрисдикции следует также учитывать юрисдикцию, уже осуществленную другим государством или международным трибуналом, а также назначенные ими <mark>наказания</mark>.	1				2310de93-f238-40da-8e0c-b675effd4a1b	00024bb00b--642fde070ebcfb11a8e7877c	bd06b4589827a2162c79f5d76770224b	2023-04-07T09:10:31.852	2023-04-07T09:11:32.584
6.14 У автора нет копий публикаций в региональных средствах массовой информации, в которых его называют <mark>убийцей</mark>.	1				d33d29b1-2851-405a-9eb1-f491ed599610	00024bb00b--642fde070ebcfb11a8e7877c	bd06b4589827a2162c79f5d76770224b	2023-04-07T09:10:31.852	2023-04-07T09:11:32.584
Такие связи должны уважать независимость судебных должностных лиц, однако они могут строиться таким образом, чтобы они приносили <mark>пользу</mark> как регулирующим органам, так и судам.	1				0ba6a21b-ac6c-4e42-b6d9-3b98bfc4898f	00024bb00b--642fde070ebcfb11a8e7877c	bd06b4589827a2162c79f5d76770224b	2023-04-07T09:10:31.852	2023-04-07T09:11:32.584
Причинами их смерти были предотвратимые и поддающиеся лечению заболевания, включая <mark>пневмонию</mark>, осложнения при преждевременных родах, осложнения при родах, диарея и малярия.	1				d096ef98-a6f5-43bc-affe-5e54f7d18cba	00024bb00b--642fde070ebcfb11a8e7877c	bd06b4589827a2162c79f5d76770224b	2023-04-07T09:10:31.852	2023-04-07T09:11:32.584
"""5.1.1.5.1 <mark>Элементы</mark> электрооборудования, включая провода, остающиеся под напряжением при разомкнутом положении главного выключателя аккумуляторной батареи, должны иметь характеристики, позволяющие использовать их в опасных зонах."	1				021b8433-3c5d-4eb2-8fad-d0db6d9a29cd	00024bb00b--642fde070ebcfb11a8e7877c	bd06b4589827a2162c79f5d76770224b	2023-04-07T09:10:31.852	2023-04-07T09:11:32.584
d) вариант 7(b): аренда общих помещений в зоне планируемой коммерческой застройки вблизи <mark>вокзала</mark> <<Пенсильвания>> на западной стороне Манхэттена;	1				9d735679-21c0-4316-8f1e-5d258bbbf1e9	00024bb00b--642fde070ebcfb11a8e7877c	bd06b4589827a2162c79f5d76770224b	2023-04-07T09:10:31.852	2023-04-07T09:11:32.584
19. В мае 1994 года Азербайджан, Нагорный <mark>Карабах</mark> и Армения подписали договоренность о прекращении огня, которая, несмотря на нарушения, действует по сей день.	1				45888c91-6bad-4a2a-a534-714d1fae8db2	00024bb00b--642fde070ebcfb11a8e7877c	bd06b4589827a2162c79f5d76770224b	2023-04-07T09:10:31.852	2023-04-07T09:11:32.584
Процентная <mark>доля</mark> двусторонних соглашений о выдаче и взаимной правовой помощи между странами внутри и за пределами каждого региона	2				d809eb10-c62a-463c-9f08-2abac7943150	00024bb00b--642fde1bfcf99b3fe7a10c5a	fc953d2e0add66c37ce69e669dd80d0b	2023-04-07T09:10:51.280	2023-04-07T09:11:27.891
Проект под названием <<Сумка мечты>> предусматривает распределение среди детей, находящихся в районах, затронутых конфликтами, <mark>сумок</mark>, наполненных канцелярскими товарами, игрушками и дружескими посланиями.	1				0d9c5356-efff-42ef-b362-5d193d3240b4	00024bb00b--642fde1bfcf99b3fe7a10c5a	fc953d2e0add66c37ce69e669dd80d0b	2023-04-07T09:10:51.280	2023-04-07T09:11:27.891
:: ЮНИСЕФ и его партнеры доставили в лагерь <<Невроз>> и мухафазу Идлиб высококалорийное <mark>печенье</mark> в количестве, которого достаточно для 30 000 детей.	1				5bddbb07-796f-49e6-beac-cda976194db0	00024bb00b--642fde1bfcf99b3fe7a10c5a	fc953d2e0add66c37ce69e669dd80d0b	2023-04-07T09:10:51.280	2023-04-07T09:11:27.891
63. Право на социальную защиту должно быть признано одним из прав человека, особенно в <mark>свете</mark> его воздействия на осуществление других прав человека.	2				31431fb5-a7ca-46aa-8c87-9f287e656649	00024bb00b--642fde1bfcf99b3fe7a10c5a	fc953d2e0add66c37ce69e669dd80d0b	2023-04-07T09:10:51.280	2023-04-07T09:11:27.891
138.4 установить мораторий на применение смертной казни в качестве предварительного шага на <mark>пути</mark> к ее окончательной отмене (Испания);	1				d241eec1-8bde-42c6-8610-21f9aac94733	00024bb00b--642fde1bfcf99b3fe7a10c5a	fc953d2e0add66c37ce69e669dd80d0b	2023-04-07T09:10:51.280	2023-04-07T09:11:27.891
:: <<Краткий анализ истории отношений между Мексикой и Соединенными Штатами>>, Национальный автономный <mark>университет</mark> Мексики, 20 февраля 1979 года	2				23e08bf6-fb29-40cb-899f-788c25a11cf6	00024bb00b--642fde1bfcf99b3fe7a10c5a	fc953d2e0add66c37ce69e669dd80d0b	2023-04-07T09:10:51.280	2023-04-07T09:11:27.891
Имею честь информировать Вас о том, что под председательством Литвы Совет Безопасности планирует провести открытые прения по вопросу о поощрении и укреплении верховенства права при поддержании международного <mark>мира</mark> и безопасности.	1				35df1b3f-f780-4b4c-a7a8-a0cb84705495	00024bb00b--642fde1bfcf99b3fe7a10c5a	fc953d2e0add66c37ce69e669dd80d0b	2023-04-07T09:10:51.280	2023-04-07T09:11:27.891
168. В некоторых случаях сообщалось о делах, связанных с <mark>мошенничеством</mark> и служебными злоупотреблениями и на уровне субподрядчиков ПИ.	2				91f47e32-2ec2-45fd-ab97-e77b2f900fff	00024bb00b--642fde1bfcf99b3fe7a10c5a	fc953d2e0add66c37ce69e669dd80d0b	2023-04-07T09:10:51.280	2023-04-07T09:11:27.891
108. Предлагается использовать следующую классификацию доступа к наружной входной двери жилья, которая основывается на таких факторах, как наличие рамп, <mark>ступенек</mark> и лифтов:	1				aa287390-5b40-416a-aebb-f4258d9d001c	00024bb00b--642fde1bfcf99b3fe7a10c5a	fc953d2e0add66c37ce69e669dd80d0b	2023-04-07T09:10:51.280	2023-04-07T09:11:27.891
26. Микромаркировка бойка <mark>ударника</mark> позволяет идентифицировать оружие лишь по стреляной гильзе, т. е. для этого не требуется проводить экспертизу самого оружия.	4				d7cc436e-b800-4bb2-9167-f7dd53dfe3c5	00024bb00b--642fde1bfcf99b3fe7a10c5a	fc953d2e0add66c37ce69e669dd80d0b	2023-04-07T09:10:51.280	2023-04-07T09:11:27.891
Согласно докладу о глобальном гендерном неравенстве (Global Gender Gap Report), который публикуется Всемирным экономическим форумом, Новая Зеландия входит в <mark>десятку</mark> стран, добившихся наибольших успехов в деле улучшения положения женщин.	1				bdcb1ff3-0ebe-45a1-a2fe-e47806898087	00024bb00b--642fde3f014251733a347761	e508503ed3b9860e5e33c314e270a1cf	2023-04-07T09:11:27.954	2023-04-07T09:11:50.058
В состав рабочей группы должны входить представители правительства (высшие должностные лица) и торговых кругов (<mark>менеджеры</mark> корпораций/компаний, специалисты по логистике...), обладающие признанной репутацией в сфере международного бизнеса.	1				df5d2b89-81ea-46ba-8ac4-aeafa12d3bad	00024bb00b--642fde3f014251733a347761	e508503ed3b9860e5e33c314e270a1cf	2023-04-07T09:11:27.954	2023-04-07T09:11:50.058
Уважаемые матери и <mark>сестры</mark>, НПО <<Ассоциация содействия иностранцам в Того>> представляет вам информацию по следующим вопросам:	1				662c4156-fa62-4d56-bdd8-144b4cfb7150	00024bb00b--642fde3f014251733a347761	e508503ed3b9860e5e33c314e270a1cf	2023-04-07T09:11:27.954	2023-04-07T09:11:50.058
